##### tcpdump
sudo tcpdump -vv -A -i wlan0 dst host 34.107.221.82
auberge de jeunesse de mulhouse, courte periode
cksum incorrectes

14:20:12.709905 IP (tos 0x0, ttl 64, id 5864, offset 0, flags [DF], proto TCP (6), length 60)
    preskhost.lan.37042 > 82.221.107.34.bc.googleusercontent.com.http: Flags [S], cksum 0xb56e (incorrect -> 0x023d), seq 2946400249, win 64240, options [mss 1460,sackOK,TS val 1786735224 ecr 0,nop,wscale 7], length 0
E..<..@.@.n.
..."k.R...P.............n.........
j.jx........
14:20:12.713019 IP (tos 0x0, ttl 64, id 5865, offset 0, flags [DF], proto TCP (6), length 52)
    preskhost.lan.37042 > 82.221.107.34.bc.googleusercontent.com.http: Flags [.], cksum 0xb566 (incorrect -> 0x2f4a), seq 2946400250, ack 1678879659, win 502, options [nop,nop,TS val 1786735227 ecr 14543372], length 0
E..4..@.@.n.
..."k.R...P....d........f.....
j.j{....
14:20:12.714405 IP (tos 0x0, ttl 64, id 5866, offset 0, flags [DF], proto TCP (6), length 345)
    preskhost.lan.37042 > 82.221.107.34.bc.googleusercontent.com.http: Flags [P.], cksum 0xb68b (incorrect -> 0x5886), seq 0:293, ack 1, win 502, options [nop,nop,TS val 1786735229 ecr 14543372], length 293: HTTP, length: 293
	GET /canonical.html HTTP/1.1
	Host: detectportal.firefox.com
	User-Agent: Mozilla/5.0 (X11; Linux x86_64; rv:129.0) Gecko/20100101 Firefox/129.0
	Accept: */*
	Accept-Language: en-US,en;q=0.5
	Accept-Encoding: gzip, deflate
	Cache-Control: no-cache
	Pragma: no-cache
	Connection: keep-alive
	
E..Y..@.@.mu
..."k.R...P....d..............
j.j}....GET /canonical.html HTTP/1.1
Host: detectportal.firefox.com
User-Agent: Mozilla/5.0 (X11; Linux x86_64; rv:129.0) Gecko/20100101 Firefox/129.0
Accept: */*
Accept-Language: en-US,en;q=0.5
Accept-Encoding: gzip, deflate
Cache-Control: no-cache
Pragma: no-cache
Connection: keep-alive


14:20:13.891191 IP (tos 0x0, ttl 64, id 5867, offset 0, flags [DF], proto TCP (6), length 52)
    preskhost.lan.37042 > 82.221.107.34.bc.googleusercontent.com.http: Flags [.], cksum 0xb566 (incorrect -> 0x298a), seq 293, ack 1, win 502, options [nop,nop,TS val 1786736406 ecr 14543372], length 0
E..4..@.@.n.
..."k.R...P....d........f.....
j.o.....
14:20:13.942480 IP (tos 0x0, ttl 64, id 5868, offset 0, flags [DF], proto TCP (6), length 52)
    preskhost.lan.37042 > 82.221.107.34.bc.googleusercontent.com.http: Flags [.], cksum 0xb566 (incorrect -> 0x289c), seq 293, ack 65, win 502, options [nop,nop,TS val 1786736457 ecr 14543495], length 0
E..4..@.@.n.
..."k.R...P....d........f.....
j.oI....
14:20:13.943013 IP (tos 0x0, ttl 64, id 5869, offset 0, flags [DF], proto TCP (6), length 52)
    preskhost.lan.37042 > 82.221.107.34.bc.googleusercontent.com.http: Flags [.], cksum 0xb566 (incorrect -> 0x22ff), seq 293, ack 1513, win 491, options [nop,nop,TS val 1786736457 ecr 14543495], length 0
E..4..@.@.n.
..."k.R...P....d........f.....
j.oI....
14:20:13.943525 IP (tos 0x0, ttl 64, id 5870, offset 0, flags [DF], proto TCP (6), length 52)
    preskhost.lan.37042 > 82.221.107.34.bc.googleusercontent.com.http: Flags [.], cksum 0xb566 (incorrect -> 0x1d61), seq 293, ack 2961, win 480, options [nop,nop,TS val 1786736458 ecr 14543495], length 0
E..4..@.@.n.
..."k.R...P....d..;.....f.....
j.oJ....
14:20:13.944517 IP (tos 0x0, ttl 64, id 5871, offset 0, flags [DF], proto TCP (6), length 52)
    preskhost.lan.37042 > 82.221.107.34.bc.googleusercontent.com.http: Flags [.], cksum 0xb566 (incorrect -> 0x1cfa), seq 293, ack 3063, win 480, options [nop,nop,TS val 1786736459 ecr 14543495], length 0
E..4..@.@.n.
..."k.R...P....d........f.....
j.oK....
14:20:13.946074 IP (tos 0x0, ttl 64, id 5872, offset 0, flags [DF], proto TCP (6), length 52)
    preskhost.lan.37042 > 82.221.107.34.bc.googleusercontent.com.http: Flags [.], cksum 0xb566 (incorrect -> 0x11be), seq 293, ack 5959, win 458, options [nop,nop,TS val 1786736461 ecr 14543495], length 0
E..4..@.@.n.
..."k.R...P....d........f.....
j.oM....
14:20:13.946104 IP (tos 0x0, ttl 64, id 5873, offset 0, flags [DF], proto TCP (6), length 52)
    preskhost.lan.37042 > 82.221.107.34.bc.googleusercontent.com.http: Flags [.], cksum 0xb566 (incorrect -> 0x0f96), seq 293, ack 6515, win 454, options [nop,nop,TS val 1786736461 ecr 14543495], length 0
E..4..@.@.n.
..."k.R...P....d........f.....
j.oM....
14:20:13.947776 IP (tos 0x0, ttl 64, id 5874, offset 0, flags [DF], proto TCP (6), length 52)
    preskhost.lan.37042 > 82.221.107.34.bc.googleusercontent.com.http: Flags [.], cksum 0xb566 (incorrect -> 0x0f93), seq 293, ack 6517, win 454, options [nop,nop,TS val 1786736462 ecr 14543495], length 0
E..4..@.@.n.
..."k.R...P....d........f.....
j.oN....
14:20:13.949648 IP (tos 0x0, ttl 64, id 5875, offset 0, flags [DF], proto TCP (6), length 52)
    preskhost.lan.37042 > 82.221.107.34.bc.googleusercontent.com.http: Flags [.], cksum 0xb566 (incorrect -> 0x0f8c), seq 293, ack 6522, win 454, options [nop,nop,TS val 1786736464 ecr 14543495], length 0
E..4..@.@.n.
..."k.R...P....d..$.....f.....
j.oP....
14:20:13.968682 IP (tos 0x0, ttl 64, id 5876, offset 0, flags [DF], proto TCP (6), length 52)
    preskhost.lan.37042 > 82.221.107.34.bc.googleusercontent.com.http: Flags [F.], cksum 0xb566 (incorrect -> 0x0f77), seq 293, ack 6523, win 454, options [nop,nop,TS val 1786736483 ecr 14543495], length 0
E..4..@.@.n.
..."k.R...P....d..%.....f.....
j.oc....
14:20:17.345394 IP (tos 0x0, ttl 64, id 38751, offset 0, flags [DF], proto TCP (6), length 60)
    preskhost.lan.37054 > 82.221.107.34.bc.googleusercontent.com.http: Flags [S], cksum 0xb56e (incorrect -> 0xd57a), seq 2859179974, win 64240, options [mss 1460,sackOK,TS val 1786739860 ecr 0,nop,wscale 7], length 0
E..<._@.@...
..."k.R...P.k...........n.........
j.|.........
14:20:17.426668 IP (tos 0x0, ttl 64, id 38752, offset 0, flags [DF], proto TCP (6), length 52)
    preskhost.lan.37054 > 82.221.107.34.bc.googleusercontent.com.http: Flags [.], cksum 0xb566 (incorrect -> 0x1d05), seq 2859179975, ack 370466059, win 502, options [nop,nop,TS val 1786739941 ecr 14543838], length 0
E..4.`@.@..#
..."k.R...P.k...........f.....
j.|.....
14:20:17.436277 IP (tos 0x0, ttl 64, id 38753, offset 0, flags [DF], proto TCP (6), length 345)
    preskhost.lan.37054 > 82.221.107.34.bc.googleusercontent.com.http: Flags [P.], cksum 0xb68b (incorrect -> 0x4639), seq 0:293, ack 1, win 502, options [nop,nop,TS val 1786739951 ecr 14543838], length 293: HTTP, length: 293
	GET /canonical.html HTTP/1.1
	Host: detectportal.firefox.com
	User-Agent: Mozilla/5.0 (X11; Linux x86_64; rv:129.0) Gecko/20100101 Firefox/129.0
	Accept: */*
	Accept-Language: en-US,en;q=0.5
	Accept-Encoding: gzip, deflate
	Cache-Control: no-cache
	Pragma: no-cache
	Connection: keep-alive
	
E..Y.a@.@...
..."k.R...P.k.................
j.|.....GET /canonical.html HTTP/1.1
Host: detectportal.firefox.com
User-Agent: Mozilla/5.0 (X11; Linux x86_64; rv:129.0) Gecko/20100101 Firefox/129.0
Accept: */*
Accept-Language: en-US,en;q=0.5
Accept-Encoding: gzip, deflate
Cache-Control: no-cache
Pragma: no-cache
Connection: keep-alive


14:20:17.519143 IP (tos 0x0, ttl 64, id 38754, offset 0, flags [DF], proto TCP (6), length 52)
    preskhost.lan.37054 > 82.221.107.34.bc.googleusercontent.com.http: Flags [.], cksum 0xb566 (incorrect -> 0x1b37), seq 293, ack 65, win 502, options [nop,nop,TS val 1786740034 ecr 14543850], length 0
E..4.b@.@..!
..."k.R...P.k.....K.....f.....
j.}B....
14:20:17.520248 IP (tos 0x0, ttl 64, id 38755, offset 0, flags [DF], proto TCP (6), length 52)
    preskhost.lan.37054 > 82.221.107.34.bc.googleusercontent.com.http: Flags [.], cksum 0xb566 (incorrect -> 0x1599), seq 293, ack 1513, win 491, options [nop,nop,TS val 1786740035 ecr 14543850], length 0
E..4.c@.@..
..."k.R...P.k...........f.....
j.}C....
14:20:17.520651 IP (tos 0x0, ttl 64, id 38756, offset 0, flags [DF], proto TCP (6), length 52)
    preskhost.lan.37054 > 82.221.107.34.bc.googleusercontent.com.http: Flags [.], cksum 0xb566 (incorrect -> 0x0ffa), seq 293, ack 2961, win 480, options [nop,nop,TS val 1786740035 ecr 14543852], length 0
E..4.d@.@...
..."k.R...P.k...........f.....
j.}C....
14:20:17.522782 IP (tos 0x0, ttl 64, id 38757, offset 0, flags [DF], proto TCP (6), length 52)
    preskhost.lan.37054 > 82.221.107.34.bc.googleusercontent.com.http: Flags [.], cksum 0xb566 (incorrect -> 0x0a5b), seq 293, ack 4409, win 469, options [nop,nop,TS val 1786740037 ecr 14543852], length 0
E..4.e@.@...
..."k.R...P.k.....C.....f.....
j.}E....
14:20:17.524247 IP (tos 0x0, ttl 64, id 38758, offset 0, flags [DF], proto TCP (6), length 52)
    preskhost.lan.37054 > 82.221.107.34.bc.googleusercontent.com.http: Flags [.], cksum 0xb566 (incorrect -> 0x04bc), seq 293, ack 5857, win 458, options [nop,nop,TS val 1786740039 ecr 14543852], length 0
E..4.f@.@...
..."k.R...P.k...........f.....
j.}G....
14:20:17.565683 IP (tos 0x0, ttl 64, id 38759, offset 0, flags [DF], proto TCP (6), length 52)
    preskhost.lan.37054 > 82.221.107.34.bc.googleusercontent.com.http: Flags [.], cksum 0xb566 (incorrect -> 0x01fd), seq 293, ack 6523, win 453, options [nop,nop,TS val 1786740080 ecr 14543853], length 0
E..4.g@.@...
..."k.R...P.k...........f.....
j.}p....
14:20:17.684995 IP (tos 0x0, ttl 64, id 38760, offset 0, flags [DF], proto TCP (6), length 52)
    preskhost.lan.37054 > 82.221.107.34.bc.googleusercontent.com.http: Flags [F.], cksum 0xb566 (incorrect -> 0x0185), seq 293, ack 6523, win 453, options [nop,nop,TS val 1786740199 ecr 14543853], length 0
E..4.h@.@...
..."k.R...P.k...........f.....
j.}.....
14:20:20.848956 IP (tos 0x0, ttl 64, id 38338, offset 0, flags [DF], proto TCP (6), length 60)
    preskhost.lan.58272 > 82.221.107.34.bc.googleusercontent.com.http: Flags [S], cksum 0xb56e (incorrect -> 0x79c4), seq 3964492041, win 64240, options [mss 1460,sackOK,TS val 1786743363 ecr 0,nop,wscale 7], length 0
E..<..@.@...
..."k.R...P.MY	.........n.........
j..C........
14:20:20.855536 IP (tos 0x0, ttl 64, id 38339, offset 0, flags [DF], proto TCP (6), length 52)
    preskhost.lan.58272 > 82.221.107.34.bc.googleusercontent.com.http: Flags [.], cksum 0xb566 (incorrect -> 0x1041), seq 3964492042, ack 1659387955, win 502, options [nop,nop,TS val 1786743370 ecr 14544186], length 0
E..4..@.@...
..."k.R...P.MY
b.@3.....f.....
j..J...:
14:20:20.858512 IP (tos 0x0, ttl 64, id 38340, offset 0, flags [DF], proto TCP (6), length 345)
    preskhost.lan.58272 > 82.221.107.34.bc.googleusercontent.com.http: Flags [P.], cksum 0xb68b (incorrect -> 0x397c), seq 0:293, ack 1, win 502, options [nop,nop,TS val 1786743373 ecr 14544186], length 293: HTTP, length: 293
	GET /canonical.html HTTP/1.1
	Host: detectportal.firefox.com
	User-Agent: Mozilla/5.0 (X11; Linux x86_64; rv:129.0) Gecko/20100101 Firefox/129.0
	Accept: */*
	Accept-Language: en-US,en;q=0.5
	Accept-Encoding: gzip, deflate
	Cache-Control: no-cache
	Pragma: no-cache
	Connection: keep-alive
	
E..Y..@.@...
..."k.R...P.MY
b.@3...........
j..M...:GET /canonical.html HTTP/1.1
Host: detectportal.firefox.com
User-Agent: Mozilla/5.0 (X11; Linux x86_64; rv:129.0) Gecko/20100101 Firefox/129.0
Accept: */*
Accept-Language: en-US,en;q=0.5
Accept-Encoding: gzip, deflate
Cache-Control: no-cache
Pragma: no-cache
Connection: keep-alive


14:20:20.896101 IP (tos 0x0, ttl 64, id 38341, offset 0, flags [DF], proto TCP (6), length 52)
    preskhost.lan.58272 > 82.221.107.34.bc.googleusercontent.com.http: Flags [.], cksum 0xb566 (incorrect -> 0x0eaf), seq 293, ack 65, win 502, options [nop,nop,TS val 1786743411 ecr 14544190], length 0
E..4..@.@...
..."k.R...P.MZ/b.@s.....f.....
j..s...>
14:20:20.916522 IP (tos 0x0, ttl 64, id 38342, offset 0, flags [DF], proto TCP (6), length 52)
    preskhost.lan.58272 > 82.221.107.34.bc.googleusercontent.com.http: Flags [.], cksum 0xb566 (incorrect -> 0xf592), seq 293, ack 6523, win 452, options [nop,nop,TS val 1786743431 ecr 14544190], length 0
E..4..@.@...
..."k.R...P.MZ/b.Y......f.....
j......>
14:20:20.951685 IP (tos 0x0, ttl 64, id 38343, offset 0, flags [DF], proto TCP (6), length 52)
    preskhost.lan.58272 > 82.221.107.34.bc.googleusercontent.com.http: Flags [F.], cksum 0xb566 (incorrect -> 0xf56e), seq 293, ack 6523, win 452, options [nop,nop,TS val 1786743466 ecr 14544190], length 0
E..4..@.@...
..."k.R...P.MZ/b.Y......f.....
j......>
14:20:24.282252 IP (tos 0x0, ttl 64, id 56700, offset 0, flags [DF], proto TCP (6), length 60)
    preskhost.lan.58284 > 82.221.107.34.bc.googleusercontent.com.http: Flags [S], cksum 0xb56e (incorrect -> 0x5ea3), seq 1646653660, win 64240, options [mss 1460,sackOK,TS val 1786746797 ecr 0,nop,wscale 7], length 0
E..<.|@.@...
..."k.R...Pb%...........n.........
j...........
14:20:24.285448 IP (tos 0x0, ttl 64, id 56701, offset 0, flags [DF], proto TCP (6), length 52)
    preskhost.lan.58284 > 82.221.107.34.bc.googleusercontent.com.http: Flags [.], cksum 0xb566 (incorrect -> 0xcc26), seq 1646653661, ack 3254257865, win 502, options [nop,nop,TS val 1786746800 ecr 14544529], length 0
E..4.}@.@...
..."k.R...Pb%...........f.....
j.......
14:20:24.285874 IP (tos 0x0, ttl 64, id 56702, offset 0, flags [DF], proto TCP (6), length 345)
    preskhost.lan.58284 > 82.221.107.34.bc.googleusercontent.com.http: Flags [P.], cksum 0xb68b (incorrect -> 0xf564), seq 0:293, ack 1, win 502, options [nop,nop,TS val 1786746800 ecr 14544529], length 293: HTTP, length: 293
	GET /canonical.html HTTP/1.1
	Host: detectportal.firefox.com
	User-Agent: Mozilla/5.0 (X11; Linux x86_64; rv:129.0) Gecko/20100101 Firefox/129.0
	Accept: */*
	Accept-Language: en-US,en;q=0.5
	Accept-Encoding: gzip, deflate
	Cache-Control: no-cache
	Pragma: no-cache
	Connection: keep-alive
	
E..Y.~@.@...
..."k.R...Pb%.................
j.......GET /canonical.html HTTP/1.1
Host: detectportal.firefox.com
User-Agent: Mozilla/5.0 (X11; Linux x86_64; rv:129.0) Gecko/20100101 Firefox/129.0
Accept: */*
Accept-Language: en-US,en;q=0.5
Accept-Encoding: gzip, deflate
Cache-Control: no-cache
Pragma: no-cache
Connection: keep-alive


14:20:24.323081 IP (tos 0x0, ttl 64, id 56703, offset 0, flags [DF], proto TCP (6), length 52)
    preskhost.lan.58284 > 82.221.107.34.bc.googleusercontent.com.http: Flags [.], cksum 0xb566 (incorrect -> 0xca97), seq 293, ack 65, win 502, options [nop,nop,TS val 1786746838 ecr 14544533], length 0
E..4..@.@...
..."k.R...Pb%....		.....f.....
j.......
14:20:24.323192 IP (tos 0x0, ttl 64, id 56704, offset 0, flags [DF], proto TCP (6), length 52)
    preskhost.lan.58284 > 82.221.107.34.bc.googleusercontent.com.http: Flags [.], cksum 0xb566 (incorrect -> 0xc4fa), seq 293, ack 1513, win 491, options [nop,nop,TS val 1786746838 ecr 14544533], length 0
E..4..@.@...
..."k.R...Pb%...........f.....
j.......
14:20:24.324578 IP (tos 0x0, ttl 64, id 56705, offset 0, flags [DF], proto TCP (6), length 52)
    preskhost.lan.58284 > 82.221.107.34.bc.googleusercontent.com.http: Flags [.], cksum 0xb566 (incorrect -> 0xbf5c), seq 293, ack 2961, win 480, options [nop,nop,TS val 1786746839 ecr 14544533], length 0
E..4..@.@...
..."k.R...Pb%.....Y.....f.....
j.......
14:20:24.324595 IP (tos 0x0, ttl 64, id 56706, offset 0, flags [DF], proto TCP (6), length 52)
    preskhost.lan.58284 > 82.221.107.34.bc.googleusercontent.com.http: Flags [.], cksum 0xb566 (incorrect -> 0xbef6), seq 293, ack 3063, win 480, options [nop,nop,TS val 1786746839 ecr 14544533], length 0
E..4..@.@...
..."k.R...Pb%...........f.....
j.......
14:20:24.325857 IP (tos 0x0, ttl 64, id 56707, offset 0, flags [DF], proto TCP (6), length 52)
    preskhost.lan.58284 > 82.221.107.34.bc.googleusercontent.com.http: Flags [.], cksum 0xb566 (incorrect -> 0xb958), seq 293, ack 4511, win 469, options [nop,nop,TS val 1786746840 ecr 14544533], length 0
E..4..@.@...
..."k.R...Pb%.....g.....f.....
j.......
14:20:24.326358 IP (tos 0x0, ttl 64, id 56708, offset 0, flags [DF], proto TCP (6), length 52)
    preskhost.lan.58284 > 82.221.107.34.bc.googleusercontent.com.http: Flags [.], cksum 0xb566 (incorrect -> 0xb3ba), seq 293, ack 5959, win 458, options [nop,nop,TS val 1786746841 ecr 14544533], length 0
E..4..@.@...
..."k.R...Pb%.... ......f.....
j.......
14:20:24.326768 IP (tos 0x0, ttl 64, id 56709, offset 0, flags [DF], proto TCP (6), length 52)
    preskhost.lan.58284 > 82.221.107.34.bc.googleusercontent.com.http: Flags [.], cksum 0xb566 (incorrect -> 0xb192), seq 293, ack 6515, win 454, options [nop,nop,TS val 1786746841 ecr 14544533], length 0
E..4..@.@...
..."k.R...Pb%....";.....f.....
j.......
14:20:24.327673 IP (tos 0x0, ttl 64, id 56710, offset 0, flags [DF], proto TCP (6), length 52)
    preskhost.lan.58284 > 82.221.107.34.bc.googleusercontent.com.http: Flags [.], cksum 0xb566 (incorrect -> 0xb18f), seq 293, ack 6517, win 454, options [nop,nop,TS val 1786746842 ecr 14544533], length 0
E..4..@.@...
..."k.R...Pb%...."=.....f.....
j.......
14:20:24.339104 IP (tos 0x0, ttl 64, id 56711, offset 0, flags [DF], proto TCP (6), length 52)
    preskhost.lan.58284 > 82.221.107.34.bc.googleusercontent.com.http: Flags [.], cksum 0xb566 (incorrect -> 0xb17e), seq 293, ack 6522, win 454, options [nop,nop,TS val 1786746854 ecr 14544533], length 0
E..4..@.@...
..."k.R...Pb%...."B.....f.....
j.......
14:20:24.339564 IP (tos 0x0, ttl 64, id 56712, offset 0, flags [DF], proto TCP (6), length 52)
    preskhost.lan.58284 > 82.221.107.34.bc.googleusercontent.com.http: Flags [F.], cksum 0xb566 (incorrect -> 0xb17c), seq 293, ack 6523, win 454, options [nop,nop,TS val 1786746854 ecr 14544533], length 0
E..4..@.@...
..."k.R...Pb%...."C.....f.....
j.......
14:20:28.092057 IP (tos 0x0, ttl 64, id 38231, offset 0, flags [DF], proto TCP (6), length 60)
    preskhost.lan.58286 > 82.221.107.34.bc.googleusercontent.com.http: Flags [S], cksum 0xb56e (incorrect -> 0xc1e1), seq 4089310497, win 64240, options [mss 1460,sackOK,TS val 1786750607 ecr 0,nop,wscale 7], length 0
E..<.W@.@..$
..."k.R...P...!.........n.........
j...........
14:20:28.094683 IP (tos 0x0, ttl 64, id 38232, offset 0, flags [DF], proto TCP (6), length 52)
    preskhost.lan.58286 > 82.221.107.34.bc.googleusercontent.com.http: Flags [.], cksum 0xb566 (incorrect -> 0x348b), seq 4089310498, ack 1599825092, win 502, options [nop,nop,TS val 1786750609 ecr 14544910], length 0
E..4.X@.@..+
..."k.R...P..."_[d......f.....
j.......
14:20:28.095113 IP (tos 0x0, ttl 64, id 38233, offset 0, flags [DF], proto TCP (6), length 345)
    preskhost.lan.58286 > 82.221.107.34.bc.googleusercontent.com.http: Flags [P.], cksum 0xb68b (incorrect -> 0x5dc8), seq 0:293, ack 1, win 502, options [nop,nop,TS val 1786750610 ecr 14544910], length 293: HTTP, length: 293
	GET /canonical.html HTTP/1.1
	Host: detectportal.firefox.com
	User-Agent: Mozilla/5.0 (X11; Linux x86_64; rv:129.0) Gecko/20100101 Firefox/129.0
	Accept: */*
	Accept-Language: en-US,en;q=0.5
	Accept-Encoding: gzip, deflate
	Cache-Control: no-cache
	Pragma: no-cache
	Connection: keep-alive
	
E..Y.Y@.@...
..."k.R...P..."_[d............
j.......GET /canonical.html HTTP/1.1
Host: detectportal.firefox.com
User-Agent: Mozilla/5.0 (X11; Linux x86_64; rv:129.0) Gecko/20100101 Firefox/129.0
Accept: */*
Accept-Language: en-US,en;q=0.5
Accept-Encoding: gzip, deflate
Cache-Control: no-cache
Pragma: no-cache
Connection: keep-alive


14:20:28.132625 IP (tos 0x0, ttl 64, id 38234, offset 0, flags [DF], proto TCP (6), length 52)
    preskhost.lan.58286 > 82.221.107.34.bc.googleusercontent.com.http: Flags [.], cksum 0xb566 (incorrect -> 0x32fc), seq 293, ack 65, win 502, options [nop,nop,TS val 1786750647 ecr 14544914], length 0
E..4.Z@.@..)
..."k.R...P...G_[e......f.....
j.......
14:20:28.133172 IP (tos 0x0, ttl 64, id 38235, offset 0, flags [DF], proto TCP (6), length 52)
    preskhost.lan.58286 > 82.221.107.34.bc.googleusercontent.com.http: Flags [.], cksum 0xb566 (incorrect -> 0x2d5e), seq 293, ack 1513, win 491, options [nop,nop,TS val 1786750648 ecr 14544914], length 0
E..4.[@.@..(
..."k.R...P...G_[j......f.....
j.......
14:20:28.133691 IP (tos 0x0, ttl 64, id 38236, offset 0, flags [DF], proto TCP (6), length 52)
    preskhost.lan.58286 > 82.221.107.34.bc.googleusercontent.com.http: Flags [.], cksum 0xb566 (incorrect -> 0x27c1), seq 293, ack 2961, win 480, options [nop,nop,TS val 1786750648 ecr 14544914], length 0
E..4.\@.@..'
..."k.R...P...G_[pT.....f.....
j.......
14:20:28.134074 IP (tos 0x0, ttl 64, id 38237, offset 0, flags [DF], proto TCP (6), length 52)
    preskhost.lan.58286 > 82.221.107.34.bc.googleusercontent.com.http: Flags [.], cksum 0xb566 (incorrect -> 0x275a), seq 293, ack 3063, win 480, options [nop,nop,TS val 1786750649 ecr 14544914], length 0
E..4.]@.@..&
..."k.R...P...G_[p......f.....
j.......
14:20:28.135247 IP (tos 0x0, ttl 64, id 38238, offset 0, flags [DF], proto TCP (6), length 52)
    preskhost.lan.58286 > 82.221.107.34.bc.googleusercontent.com.http: Flags [.], cksum 0xb566 (incorrect -> 0x2729), seq 293, ack 3111, win 480, options [nop,nop,TS val 1786750650 ecr 14544914], length 0
E..4.^@.@..%
..."k.R...P...G_[p......f.....
j.......
14:20:28.136839 IP (tos 0x0, ttl 64, id 38239, offset 0, flags [DF], proto TCP (6), length 52)
    preskhost.lan.58286 > 82.221.107.34.bc.googleusercontent.com.http: Flags [.], cksum 0xb566 (incorrect -> 0x1bee), seq 293, ack 6007, win 458, options [nop,nop,TS val 1786750651 ecr 14544914], length 0
E..4._@.@..$
..."k.R...P...G_[|:.....f.....
j.......
14:20:28.136878 IP (tos 0x0, ttl 64, id 38240, offset 0, flags [DF], proto TCP (6), length 52)
    preskhost.lan.58286 > 82.221.107.34.bc.googleusercontent.com.http: Flags [.], cksum 0xb566 (incorrect -> 0x19f5), seq 293, ack 6515, win 455, options [nop,nop,TS val 1786750651 ecr 14544914], length 0
E..4.`@.@..#
..."k.R...P...G_[~6.....f.....
j.......
14:20:28.137783 IP (tos 0x0, ttl 64, id 38241, offset 0, flags [DF], proto TCP (6), length 52)
    preskhost.lan.58286 > 82.221.107.34.bc.googleusercontent.com.http: Flags [.], cksum 0xb566 (incorrect -> 0x19f2), seq 293, ack 6517, win 455, options [nop,nop,TS val 1786750652 ecr 14544914], length 0
E..4.a@.@.."
..."k.R...P...G_[~8.....f.....
j.......
14:20:28.140592 IP (tos 0x0, ttl 64, id 38242, offset 0, flags [DF], proto TCP (6), length 52)
    preskhost.lan.58286 > 82.221.107.34.bc.googleusercontent.com.http: Flags [.], cksum 0xb566 (incorrect -> 0x19ea), seq 293, ack 6522, win 455, options [nop,nop,TS val 1786750655 ecr 14544914], length 0
E..4.b@.@..!
..."k.R...P...G_[~=.....f.....
j.......
14:20:28.141279 IP (tos 0x0, ttl 64, id 38243, offset 0, flags [DF], proto TCP (6), length 52)
    preskhost.lan.58286 > 82.221.107.34.bc.googleusercontent.com.http: Flags [F.], cksum 0xb566 (incorrect -> 0x19e7), seq 293, ack 6523, win 455, options [nop,nop,TS val 1786750656 ecr 14544914], length 0
E..4.c@.@..
..."k.R...P...G_[~>.....f.....
j.......
14:20:31.787193 IP (tos 0x0, ttl 64, id 59761, offset 0, flags [DF], proto TCP (6), length 60)
    preskhost.lan.55870 > 82.221.107.34.bc.googleusercontent.com.http: Flags [S], cksum 0xb56e (incorrect -> 0x6dbd), seq 3758051333, win 64240, options [mss 1460,sackOK,TS val 1786754302 ecr 0,nop,wscale 7], length 0
E..<.q@.@..

..."k.R.>.P..P..........n.........
j...........
14:20:31.788635 IP (tos 0x0, ttl 64, id 59762, offset 0, flags [DF], proto TCP (6), length 52)
    preskhost.lan.55870 > 82.221.107.34.bc.googleusercontent.com.http: Flags [.], cksum 0xb566 (incorrect -> 0xb714), seq 3758051334, ack 3157143507, win 502, options [nop,nop,TS val 1786754303 ecr 14545279], length 0
E..4.r@.@...
..."k.R.>.P..P.../......f.....
j.......
14:20:31.789096 IP (tos 0x0, ttl 64, id 59763, offset 0, flags [DF], proto TCP (6), length 345)
    preskhost.lan.55870 > 82.221.107.34.bc.googleusercontent.com.http: Flags [P.], cksum 0xb68b (incorrect -> 0xe051), seq 0:293, ack 1, win 502, options [nop,nop,TS val 1786754304 ecr 14545279], length 293: HTTP, length: 293
	GET /canonical.html HTTP/1.1
	Host: detectportal.firefox.com
	User-Agent: Mozilla/5.0 (X11; Linux x86_64; rv:129.0) Gecko/20100101 Firefox/129.0
	Accept: */*
	Accept-Language: en-US,en;q=0.5
	Accept-Encoding: gzip, deflate
	Cache-Control: no-cache
	Pragma: no-cache
	Connection: keep-alive
	
E..Y.s@.@...
..."k.R.>.P..P.../............
j.......GET /canonical.html HTTP/1.1
Host: detectportal.firefox.com
User-Agent: Mozilla/5.0 (X11; Linux x86_64; rv:129.0) Gecko/20100101 Firefox/129.0
Accept: */*
Accept-Language: en-US,en;q=0.5
Accept-Encoding: gzip, deflate
Cache-Control: no-cache
Pragma: no-cache
Connection: keep-alive


14:20:31.828630 IP (tos 0x0, ttl 64, id 59764, offset 0, flags [DF], proto TCP (6), length 52)
    preskhost.lan.55870 > 82.221.107.34.bc.googleusercontent.com.http: Flags [.], cksum 0xb566 (incorrect -> 0xb583), seq 293, ack 65, win 502, options [nop,nop,TS val 1786754343 ecr 14545283], length 0
E..4.t@.@...
..."k.R.>.P..Q+..0......f.....
j..'....
14:20:31.829233 IP (tos 0x0, ttl 64, id 59765, offset 0, flags [DF], proto TCP (6), length 52)
    preskhost.lan.55870 > 82.221.107.34.bc.googleusercontent.com.http: Flags [.], cksum 0xb566 (incorrect -> 0xafe5), seq 293, ack 1513, win 491, options [nop,nop,TS val 1786754344 ecr 14545283], length 0
E..4.u@.@...
..."k.R.>.P..Q+..5......f.....
j..(....
14:20:31.829787 IP (tos 0x0, ttl 64, id 59766, offset 0, flags [DF], proto TCP (6), length 52)
    preskhost.lan.55870 > 82.221.107.34.bc.googleusercontent.com.http: Flags [.], cksum 0xb566 (incorrect -> 0xaa48), seq 293, ack 2961, win 480, options [nop,nop,TS val 1786754344 ecr 14545283], length 0
E..4.v@.@..
..."k.R.>.P..Q+..;c.....f.....
j..(....
14:20:31.829876 IP (tos 0x0, ttl 64, id 59767, offset 0, flags [DF], proto TCP (6), length 52)
    preskhost.lan.55870 > 82.221.107.34.bc.googleusercontent.com.http: Flags [.], cksum 0xb566 (incorrect -> 0xa9e2), seq 293, ack 3063, win 480, options [nop,nop,TS val 1786754344 ecr 14545283], length 0
E..4.w@.@...
..."k.R.>.P..Q+..;......f.....
j..(....
14:20:31.832754 IP (tos 0x0, ttl 64, id 59768, offset 0, flags [DF], proto TCP (6), length 52)
    preskhost.lan.55870 > 82.221.107.34.bc.googleusercontent.com.http: Flags [.], cksum 0xb566 (incorrect -> 0xa9db), seq 293, ack 3067, win 480, options [nop,nop,TS val 1786754347 ecr 14545283], length 0
E..4.x@.@...
..."k.R.>.P..Q+..;......f.....
j..+....
14:20:31.833260 IP (tos 0x0, ttl 64, id 59769, offset 0, flags [DF], proto TCP (6), length 52)
    preskhost.lan.55870 > 82.221.107.34.bc.googleusercontent.com.http: Flags [.], cksum 0xb566 (incorrect -> 0xa43c), seq 293, ack 4515, win 469, options [nop,nop,TS val 1786754348 ecr 14545284], length 0
E..4.y@.@..

..."k.R.>.P..Q+..Au.....f.....
j..,....
14:20:31.836269 IP (tos 0x0, ttl 64, id 59770, offset 0, flags [DF], proto TCP (6), length 52)
    preskhost.lan.55870 > 82.221.107.34.bc.googleusercontent.com.http: Flags [.], cksum 0xb566 (incorrect -> 0x9c70), seq 293, ack 6523, win 454, options [nop,nop,TS val 1786754351 ecr 14545284], length 0
E..4.z@.@..	
..."k.R.>.P..Q+..IM.....f.....
j../....
14:20:31.836876 IP (tos 0x0, ttl 64, id 59771, offset 0, flags [DF], proto TCP (6), length 52)
    preskhost.lan.55870 > 82.221.107.34.bc.googleusercontent.com.http: Flags [F.], cksum 0xb566 (incorrect -> 0x9c6f), seq 293, ack 6523, win 454, options [nop,nop,TS val 1786754351 ecr 14545284], length 0
E..4.{@.@...
..."k.R.>.P..Q+..IM.....f.....
j../....
14:20:35.444488 IP (tos 0x0, ttl 64, id 2948, offset 0, flags [DF], proto TCP (6), length 60)
    preskhost.lan.55874 > 82.221.107.34.bc.googleusercontent.com.http: Flags [S], cksum 0xb56e (incorrect -> 0x3ac1), seq 2861476389, win 64240, options [mss 1460,sackOK,TS val 1786757959 ecr 0,nop,wscale 7], length 0
E..<..@.@.y.
..."k.R.B.P...%.........n.........
j..G........
14:20:35.449478 IP (tos 0x0, ttl 64, id 2949, offset 0, flags [DF], proto TCP (6), length 52)
    preskhost.lan.55874 > 82.221.107.34.bc.googleusercontent.com.http: Flags [.], cksum 0xb566 (incorrect -> 0x83f7), seq 2861476390, ack 2184538235, win 502, options [nop,nop,TS val 1786757964 ecr 14545645], length 0
E..4..@.@.y.
..."k.R.B.P...&.5h{.....f.....
j..L....
14:20:35.449962 IP (tos 0x0, ttl 64, id 2950, offset 0, flags [DF], proto TCP (6), length 345)
    preskhost.lan.55874 > 82.221.107.34.bc.googleusercontent.com.http: Flags [P.], cksum 0xb68b (incorrect -> 0xad35), seq 0:293, ack 1, win 502, options [nop,nop,TS val 1786757964 ecr 14545645], length 293: HTTP, length: 293
	GET /canonical.html HTTP/1.1
	Host: detectportal.firefox.com
	User-Agent: Mozilla/5.0 (X11; Linux x86_64; rv:129.0) Gecko/20100101 Firefox/129.0
	Accept: */*
	Accept-Language: en-US,en;q=0.5
	Accept-Encoding: gzip, deflate
	Cache-Control: no-cache
	Pragma: no-cache
	Connection: keep-alive
	
E..Y..@.@.x.
..."k.R.B.P...&.5h{...........
j..L....GET /canonical.html HTTP/1.1
Host: detectportal.firefox.com
User-Agent: Mozilla/5.0 (X11; Linux x86_64; rv:129.0) Gecko/20100101 Firefox/129.0
Accept: */*
Accept-Language: en-US,en;q=0.5
Accept-Encoding: gzip, deflate
Cache-Control: no-cache
Pragma: no-cache
Connection: keep-alive


14:20:35.486409 IP (tos 0x0, ttl 64, id 2951, offset 0, flags [DF], proto TCP (6), length 52)
    preskhost.lan.55874 > 82.221.107.34.bc.googleusercontent.com.http: Flags [.], cksum 0xb566 (incorrect -> 0x8269), seq 293, ack 65, win 502, options [nop,nop,TS val 1786758001 ecr 14545649], length 0
E..4..@.@.y.
..."k.R.B.P...K.5h......f.....
j..q....
14:20:35.486985 IP (tos 0x0, ttl 64, id 2952, offset 0, flags [DF], proto TCP (6), length 52)
    preskhost.lan.55874 > 82.221.107.34.bc.googleusercontent.com.http: Flags [.], cksum 0xb566 (incorrect -> 0x7ccc), seq 293, ack 1513, win 491, options [nop,nop,TS val 1786758001 ecr 14545649], length 0
E..4..@.@.y.
..."k.R.B.P...K.5nc.....f.....
j..q....
14:20:35.487484 IP (tos 0x0, ttl 64, id 2953, offset 0, flags [DF], proto TCP (6), length 52)
    preskhost.lan.55874 > 82.221.107.34.bc.googleusercontent.com.http: Flags [.], cksum 0xb566 (incorrect -> 0x772e), seq 293, ack 2961, win 480, options [nop,nop,TS val 1786758002 ecr 14545649], length 0
E..4..@.@.y.
..."k.R.B.P...K.5t......f.....
j..r....
14:20:35.488544 IP (tos 0x0, ttl 64, id 2954, offset 0, flags [DF], proto TCP (6), length 52)
    preskhost.lan.55874 > 82.221.107.34.bc.googleusercontent.com.http: Flags [.], cksum 0xb566 (incorrect -> 0x76ec), seq 293, ack 3026, win 480, options [nop,nop,TS val 1786758003 ecr 14545649], length 0
E..4..@.@.y.
..."k.R.B.P...K.5tL.....f.....
j..s....
14:20:35.490063 IP (tos 0x0, ttl 64, id 2955, offset 0, flags [DF], proto TCP (6), length 52)
    preskhost.lan.55874 > 82.221.107.34.bc.googleusercontent.com.http: Flags [.], cksum 0xb566 (incorrect -> 0x714d), seq 293, ack 4474, win 469, options [nop,nop,TS val 1786758005 ecr 14545649], length 0
E..4..@.@.y.
..."k.R.B.P...K.5y......f.....
j..u....
14:20:35.490204 IP (tos 0x0, ttl 64, id 2956, offset 0, flags [DF], proto TCP (6), length 52)
    preskhost.lan.55874 > 82.221.107.34.bc.googleusercontent.com.http: Flags [.], cksum 0xb566 (incorrect -> 0x6bb0), seq 293, ack 5922, win 458, options [nop,nop,TS val 1786758005 ecr 14545649], length 0
E..4..@.@.y.
..."k.R.B.P...K.5.......f.....
j..u....
14:20:35.490854 IP (tos 0x0, ttl 64, id 2957, offset 0, flags [DF], proto TCP (6), length 52)
    preskhost.lan.55874 > 82.221.107.34.bc.googleusercontent.com.http: Flags [.], cksum 0xb566 (incorrect -> 0x6963), seq 293, ack 6515, win 454, options [nop,nop,TS val 1786758005 ecr 14545649], length 0
E..4..@.@.y.
..."k.R.B.P...K.5.......f.....
j..u....
14:20:35.492448 IP (tos 0x0, ttl 64, id 2958, offset 0, flags [DF], proto TCP (6), length 52)
    preskhost.lan.55874 > 82.221.107.34.bc.googleusercontent.com.http: Flags [.], cksum 0xb566 (incorrect -> 0x695e), seq 293, ack 6517, win 454, options [nop,nop,TS val 1786758007 ecr 14545650], length 0
E..4..@.@.y.
..."k.R.B.P...K.5.......f.....
j..w....
14:20:35.494351 IP (tos 0x0, ttl 64, id 2959, offset 0, flags [DF], proto TCP (6), length 52)
    preskhost.lan.55874 > 82.221.107.34.bc.googleusercontent.com.http: Flags [.], cksum 0xb566 (incorrect -> 0x6957), seq 293, ack 6522, win 454, options [nop,nop,TS val 1786758009 ecr 14545650], length 0
E..4..@.@.y.
..."k.R.B.P...K.5.......f.....
j..y....
14:20:35.495126 IP (tos 0x0, ttl 64, id 2960, offset 0, flags [DF], proto TCP (6), length 52)
    preskhost.lan.55874 > 82.221.107.34.bc.googleusercontent.com.http: Flags [F.], cksum 0xb566 (incorrect -> 0x6955), seq 293, ack 6522, win 454, options [nop,nop,TS val 1786758010 ecr 14545650], length 0
E..4..@.@.y.
..."k.R.B.P...K.5.......f.....
j..z....
14:20:35.497531 IP (tos 0x0, ttl 64, id 2961, offset 0, flags [DF], proto TCP (6), length 52)
    preskhost.lan.55874 > 82.221.107.34.bc.googleusercontent.com.http: Flags [.], cksum 0xb566 (incorrect -> 0x6952), seq 294, ack 6523, win 454, options [nop,nop,TS val 1786758012 ecr 14545650], length 0
E..4..@.@.y.
..."k.R.B.P...L.5.......f.....
j..|....
14:20:38.900502 IP (tos 0x0, ttl 64, id 6363, offset 0, flags [DF], proto TCP (6), length 60)
    preskhost.lan.55886 > 82.221.107.34.bc.googleusercontent.com.http: Flags [S], cksum 0xb56e (incorrect -> 0x1acd), seq 832845176, win 64240, options [mss 1460,sackOK,TS val 1786761415 ecr 0,nop,wscale 7], length 0
E..<..@.@.l.
..."k.R.N.P1.5x.........n.........
j...........
14:20:38.903754 IP (tos 0x0, ttl 64, id 6364, offset 0, flags [DF], proto TCP (6), length 52)
    preskhost.lan.55886 > 82.221.107.34.bc.googleusercontent.com.http: Flags [.], cksum 0xb566 (incorrect -> 0x6524), seq 832845177, ack 1893758807, win 502, options [nop,nop,TS val 1786761418 ecr 14545991], length 0
E..4..@.@.l.
..."k.R.N.P1.5yp.wW.....f.....
j......G
14:20:38.904063 IP (tos 0x0, ttl 64, id 6365, offset 0, flags [DF], proto TCP (6), length 345)
    preskhost.lan.55886 > 82.221.107.34.bc.googleusercontent.com.http: Flags [P.], cksum 0xb68b (incorrect -> 0x8e61), seq 0:293, ack 1, win 502, options [nop,nop,TS val 1786761419 ecr 14545991], length 293: HTTP, length: 293
	GET /canonical.html HTTP/1.1
	Host: detectportal.firefox.com
	User-Agent: Mozilla/5.0 (X11; Linux x86_64; rv:129.0) Gecko/20100101 Firefox/129.0
	Accept: */*
	Accept-Language: en-US,en;q=0.5
	Accept-Encoding: gzip, deflate
	Cache-Control: no-cache
	Pragma: no-cache
	Connection: keep-alive
	
E..Y..@.@.k.
..."k.R.N.P1.5yp.wW...........
j......GGET /canonical.html HTTP/1.1
Host: detectportal.firefox.com
User-Agent: Mozilla/5.0 (X11; Linux x86_64; rv:129.0) Gecko/20100101 Firefox/129.0
Accept: */*
Accept-Language: en-US,en;q=0.5
Accept-Encoding: gzip, deflate
Cache-Control: no-cache
Pragma: no-cache
Connection: keep-alive


14:20:38.942521 IP (tos 0x0, ttl 64, id 6366, offset 0, flags [DF], proto TCP (6), length 52)
    preskhost.lan.55886 > 82.221.107.34.bc.googleusercontent.com.http: Flags [.], cksum 0xb566 (incorrect -> 0x6395), seq 293, ack 65, win 502, options [nop,nop,TS val 1786761457 ecr 14545994], length 0
E..4..@.@.l.
..."k.R.N.P1.6.p.w......f.....
j......J
14:20:38.942561 IP (tos 0x0, ttl 64, id 6367, offset 0, flags [DF], proto TCP (6), length 52)
    preskhost.lan.55886 > 82.221.107.34.bc.googleusercontent.com.http: Flags [.], cksum 0xb566 (incorrect -> 0x585b), seq 293, ack 2961, win 480, options [nop,nop,TS val 1786761457 ecr 14545994], length 0
E..4..@.@.l.
..."k.R.N.P1.6.p........f.....
j......J
14:20:38.945089 IP (tos 0x0, ttl 64, id 6368, offset 0, flags [DF], proto TCP (6), length 52)
    preskhost.lan.55886 > 82.221.107.34.bc.googleusercontent.com.http: Flags [.], cksum 0xb566 (incorrect -> 0x52ba), seq 293, ack 4409, win 469, options [nop,nop,TS val 1786761460 ecr 14545995], length 0
E..4..@.@.l.
..."k.R.N.P1.6.p........f.....
j......K
14:20:38.953646 IP (tos 0x0, ttl 64, id 6369, offset 0, flags [DF], proto TCP (6), length 52)
    preskhost.lan.55886 > 82.221.107.34.bc.googleusercontent.com.http: Flags [.], cksum 0xb566 (incorrect -> 0x4d15), seq 293, ack 5857, win 458, options [nop,nop,TS val 1786761468 ecr 14545995], length 0
E..4..@.@.l.
..."k.R.N.P1.6.p..7.....f.....
j......K
14:20:38.953692 IP (tos 0x0, ttl 64, id 6370, offset 0, flags [DF], proto TCP (6), length 52)
    preskhost.lan.55886 > 82.221.107.34.bc.googleusercontent.com.http: Flags [.], cksum 0xb566 (incorrect -> 0x4a86), seq 293, ack 6517, win 453, options [nop,nop,TS val 1786761468 ecr 14545995], length 0
E..4..@.@.l.
..."k.R.N.P1.6.p........f.....
j......K
14:20:38.954404 IP (tos 0x0, ttl 64, id 6371, offset 0, flags [DF], proto TCP (6), length 52)
    preskhost.lan.55886 > 82.221.107.34.bc.googleusercontent.com.http: Flags [F.], cksum 0xb566 (incorrect -> 0x4a7e), seq 293, ack 6523, win 453, options [nop,nop,TS val 1786761469 ecr 14545995], length 0
E..4..@.@.l.
..."k.R.N.P1.6.p........f.....
j......K
14:20:42.117728 IP (tos 0x0, ttl 64, id 49258, offset 0, flags [DF], proto TCP (6), length 60)
    preskhost.lan.52652 > 82.221.107.34.bc.googleusercontent.com.http: Flags [S], cksum 0xb56e (incorrect -> 0x0651), seq 1473455062, win 64240, options [mss 1460,sackOK,TS val 1786764632 ecr 0,nop,wscale 7], length 0
E..<.j@.@...
..."k.R...PW.#..........n.........
j..X........
14:20:42.120916 IP (tos 0x0, ttl 64, id 49259, offset 0, flags [DF], proto TCP (6), length 52)
    preskhost.lan.52652 > 82.221.107.34.bc.googleusercontent.com.http: Flags [.], cksum 0xb566 (incorrect -> 0x035b), seq 1473455063, ack 149760855, win 502, options [nop,nop,TS val 1786764635 ecr 14546312], length 0
E..4.k@.@...
..."k.R...PW.#...+W.....f.....
j..[....
14:20:42.121146 IP (tos 0x0, ttl 64, id 49260, offset 0, flags [DF], proto TCP (6), length 345)
    preskhost.lan.52652 > 82.221.107.34.bc.googleusercontent.com.http: Flags [P.], cksum 0xb68b (incorrect -> 0x2c98), seq 0:293, ack 1, win 502, options [nop,nop,TS val 1786764636 ecr 14546312], length 293: HTTP, length: 293
	GET /canonical.html HTTP/1.1
	Host: detectportal.firefox.com
	User-Agent: Mozilla/5.0 (X11; Linux x86_64; rv:129.0) Gecko/20100101 Firefox/129.0
	Accept: */*
	Accept-Language: en-US,en;q=0.5
	Accept-Encoding: gzip, deflate
	Cache-Control: no-cache
	Pragma: no-cache
	Connection: keep-alive
	
E..Y.l@.@...
..."k.R...PW.#...+W...........
j..\....GET /canonical.html HTTP/1.1
Host: detectportal.firefox.com
User-Agent: Mozilla/5.0 (X11; Linux x86_64; rv:129.0) Gecko/20100101 Firefox/129.0
Accept: */*
Accept-Language: en-US,en;q=0.5
Accept-Encoding: gzip, deflate
Cache-Control: no-cache
Pragma: no-cache
Connection: keep-alive


14:20:42.160027 IP (tos 0x0, ttl 64, id 49261, offset 0, flags [DF], proto TCP (6), length 52)
    preskhost.lan.52652 > 82.221.107.34.bc.googleusercontent.com.http: Flags [.], cksum 0xb566 (incorrect -> 0x01cb), seq 293, ack 65, win 502, options [nop,nop,TS val 1786764674 ecr 14546316], length 0
E..4.m@.@...
..."k.R...PW.$...+......f.....
j.......
14:20:42.160054 IP (tos 0x0, ttl 64, id 49262, offset 0, flags [DF], proto TCP (6), length 52)
    preskhost.lan.52652 > 82.221.107.34.bc.googleusercontent.com.http: Flags [.], cksum 0xb566 (incorrect -> 0xf68f), seq 293, ack 2961, win 480, options [nop,nop,TS val 1786764675 ecr 14546316], length 0
E..4.n@.@...
..."k.R...PW.$...6......f.....
j.......
14:20:42.160973 IP (tos 0x0, ttl 64, id 49263, offset 0, flags [DF], proto TCP (6), length 52)
    preskhost.lan.52652 > 82.221.107.34.bc.googleusercontent.com.http: Flags [.], cksum 0xb566 (incorrect -> 0xf0f2), seq 293, ack 4409, win 469, options [nop,nop,TS val 1786764675 ecr 14546316], length 0
E..4.o@.@...
..."k.R...PW.$...<......f.....
j.......
14:20:42.161414 IP (tos 0x0, ttl 64, id 49264, offset 0, flags [DF], proto TCP (6), length 52)
    preskhost.lan.52652 > 82.221.107.34.bc.googleusercontent.com.http: Flags [.], cksum 0xb566 (incorrect -> 0xeb54), seq 293, ack 5857, win 458, options [nop,nop,TS val 1786764676 ecr 14546316], length 0
E..4.p@.@...
..."k.R...PW.$...B7.....f.....
j.......
14:20:42.161857 IP (tos 0x0, ttl 64, id 49265, offset 0, flags [DF], proto TCP (6), length 52)
    preskhost.lan.52652 > 82.221.107.34.bc.googleusercontent.com.http: Flags [.], cksum 0xb566 (incorrect -> 0xe8c7), seq 293, ack 6515, win 453, options [nop,nop,TS val 1786764676 ecr 14546316], length 0
E..4.q@.@...
..."k.R...PW.$...D......f.....
