00:06:27.194061 IP livebox.home > all-systems.mcast.net: igmp query v2
00:06:37.841767 ARP, Reply pote.home is-at 0c:7a:15:cb:45:fd (oui Unknown), length 28
00:06:38.148525 ARP, Reply pote.home is-at 0c:7a:15:cb:45:fd (oui Unknown), length 28
00:06:39.991945 IP pc-29.home.63158 > 255.255.255.255.teradataordbms: UDP, length 20
00:06:39.991945 44:d4:53:9d:92:d0 (oui Unknown) > Broadcast, ethertype Unknown (0x88e1), length 60: 
	0x0000:  0120 6000 0000 0000 0000 0000 0000 0000  ..`.............
	0x0010:  0000 0000 0000 0000 0000 0000 0000 0000  ................
	0x0020:  0000 0000 0000 0000 0000 0000 0000       ..............
00:06:40.096791 IP livebox.home > 232.0.3.36: igmp query v2 [max resp time 1] [gaddr 232.0.3.36]
00:06:40.096792 IP livebox.home > 232.0.3.36: igmp query v2 [max resp time 1] [gaddr 232.0.3.36]
00:06:44.599843 44:d4:53:9d:92:d0 (oui Unknown) > Broadcast, ethertype Unknown (0x887b), length 60: 
	0x0000:  0102 0400 0487 1000 0000 0000 0000 0000  ................
	0x0010:  0000 0000 0000 0000 0000 0000 0000 0000  ................
	0x0020:  0000 0000 0000 0000 0000 0000 0000       ..............
00:06:53.201362 IP rdc0124-gk.home.netbios-ns > 192.168.1.255.netbios-ns: UDP, length 50
00:06:53.816105 IP rdc0124-gk.home.netbios-ns > 192.168.1.255.netbios-ns: UDP, length 50
00:06:54.737544 IP rdc0124-gk.home.netbios-ns > 192.168.1.255.netbios-ns: UDP, length 50
00:07:07.026256 IP livebox.home > all-systems.mcast.net: igmp query v2
00:07:09.790255 IP pc-13.home > 224.0.0.252: igmp v2 report 224.0.0.252
00:07:10.405195 IP pc-29.home.63159 > 255.255.255.255.teradataordbms: UDP, length 20
00:07:14.705888 44:d4:53:9d:92:d0 (oui Unknown) > Broadcast, ethertype Unknown (0x887b), length 60: 
	0x0000:  0102 0400 0487 1000 0000 0000 0000 0000  ................
	0x0010:  0000 0000 0000 0000 0000 0000 0000 0000  ................
	0x0020:  0000 0000 0000 0000 0000 0000 0000       ..............
00:07:24.844420 IP livebox.home.netbios-dgm > 192.168.1.255.netbios-dgm: UDP, length 208
00:07:30.071111 IP pc-29.home.55629 > 224.0.0.252.llmnr: UDP, length 25
00:07:30.071111 IP pc-29.home.60521 > 224.0.0.252.llmnr: UDP, length 25
00:07:30.071111 IP pc-29.home.netbios-dgm > 192.168.1.255.netbios-dgm: UDP, length 174
00:07:30.071111 IP ic-418-4745.home.netbios-ns > 192.168.1.255.netbios-ns: UDP, length 50
00:07:30.071111 IP ic-418-4745.home.netbios-ns > 192.168.1.255.netbios-ns: UDP, length 50
00:07:30.681453 IP pc-29.home.netbios-ns > 192.168.1.255.netbios-ns: UDP, length 50
00:07:31.602254 IP pc-29.home.netbios-ns > 192.168.1.255.netbios-ns: UDP, length 50
00:07:32.217371 IP pc-29.home.netbios-dgm > 192.168.1.255.netbios-dgm: UDP, length 174
00:07:32.217372 IP pc-29.home.netbios-ns > 192.168.1.255.netbios-ns: UDP, length 50
00:07:40.207064 IP pc-13.home.netbios-ns > 192.168.1.255.netbios-ns: UDP, length 50
00:07:40.207066 IP6 fe80::dc8b:7e8c:3540:d0b6.61835 > ff02::1:3.llmnr: UDP, length 33
00:07:40.207066 IP pc-13.home.58374 > 224.0.0.252.llmnr: UDP, length 33
00:07:40.208781 IP6 fe80::dc8b:7e8c:3540:d0b6.55199 > ff02::1:3.llmnr: UDP, length 33
00:07:40.208781 IP6 fe80::dc8b:7e8c:3540:d0b6.63700 > ff02::1:3.llmnr: UDP, length 33
00:07:40.208781 IP pc-13.home.63700 > 224.0.0.252.llmnr: UDP, length 33
00:07:40.819156 IP6 fe80::dc8b:7e8c:3540:d0b6.55199 > ff02::1:3.llmnr: UDP, length 33
00:07:40.819157 IP pc-13.home.55199 > 224.0.0.252.llmnr: UDP, length 33
00:07:40.819157 IP pc-13.home.63700 > 224.0.0.252.llmnr: UDP, length 33
00:07:41.125989 IP pc-29.home.60522 > 255.255.255.255.teradataordbms: UDP, length 20
00:07:41.435392 IP pc-13.home.54616 > 224.0.0.252.llmnr: UDP, length 33
00:07:41.436102 IP6 fe80::dc8b:7e8c:3540:d0b6.53781 > ff02::1:3.llmnr: UDP, length 33
00:07:41.436102 IP pc-13.home.53781 > 224.0.0.252.llmnr: UDP, length 33
00:07:44.812129 44:d4:53:9d:92:d0 (oui Unknown) > Broadcast, ethertype Unknown (0x887b), length 60: 
	0x0000:  0102 0400 0487 1000 0000 0000 0000 0000  ................
	0x0010:  0000 0000 0000 0000 0000 0000 0000 0000  ................
	0x0020:  0000 0000 0000 0000 0000 0000 0000       ..............
00:07:46.964076 IP livebox.home > all-systems.mcast.net: igmp query v2
00:07:49.420301 IP pc-13.home > 224.0.0.252: igmp v2 report 224.0.0.252
00:07:52.199853 IP pote.home.38694 > livebox.home.domain: 19788+ [1au] AAAA? safebrowsing.googleapis.com. (56)
00:07:52.200021 IP pote.home.39717 > livebox.home.domain: 22428+ [1au] A? safebrowsing.googleapis.com. (56)
00:07:52.207740 IP livebox.home.domain > pote.home.39717: 22428 1/0/1 A 142.250.178.138 (72)
00:07:52.208852 IP pote.home.53038 > par21s22-in-f10.1e100.net.https: Flags [S], seq 3293357729, win 64240, options [mss 1460,sackOK,TS val 3262340395 ecr 0,nop,wscale 7], length 0
00:07:52.215306 IP livebox.home.domain > pote.home.38694: 19788 1/0/1 AAAA 2a00:1450:4007:819::200a (84)
00:07:52.221780 IP par21s22-in-f10.1e100.net.https > pote.home.53038: Flags [S.], seq 3286505506, ack 3293357730, win 65535, options [mss 1412,sackOK,TS val 2731669810 ecr 3262340395,nop,wscale 8], length 0
00:07:52.221908 IP pote.home.53038 > par21s22-in-f10.1e100.net.https: Flags [.], ack 1, win 502, options [nop,nop,TS val 3262340408 ecr 2731669810], length 0
00:07:52.223105 IP pote.home.53038 > par21s22-in-f10.1e100.net.https: Flags [P.], seq 1:676, ack 1, win 502, options [nop,nop,TS val 3262340410 ecr 2731669810], length 675
00:07:52.238424 IP par21s22-in-f10.1e100.net.https > pote.home.53038: Flags [.], ack 676, win 262, options [nop,nop,TS val 2731669826 ecr 3262340410], length 0
00:07:52.242700 IP par21s22-in-f10.1e100.net.https > pote.home.53038: Flags [.], seq 1:1401, ack 676, win 262, options [nop,nop,TS val 2731669831 ecr 3262340410], length 1400
00:07:52.242973 IP pote.home.53038 > par21s22-in-f10.1e100.net.https: Flags [.], ack 1401, win 492, options [nop,nop,TS val 3262340429 ecr 2731669831], length 0
00:07:52.243039 IP par21s22-in-f10.1e100.net.https > pote.home.53038: Flags [P.], seq 1401:2801, ack 676, win 262, options [nop,nop,TS val 2731669831 ecr 3262340410], length 1400
00:07:52.243039 IP par21s22-in-f10.1e100.net.https > pote.home.53038: Flags [P.], seq 2801:4495, ack 676, win 262, options [nop,nop,TS val 2731669831 ecr 3262340410], length 1694
00:07:52.243102 IP pote.home.53038 > par21s22-in-f10.1e100.net.https: Flags [.], ack 2801, win 482, options [nop,nop,TS val 3262340430 ecr 2731669831], length 0
00:07:52.243152 IP pote.home.53038 > par21s22-in-f10.1e100.net.https: Flags [.], ack 4495, win 469, options [nop,nop,TS val 3262340430 ecr 2731669831], length 0
00:07:52.249699 IP pote.home.53038 > par21s22-in-f10.1e100.net.https: Flags [P.], seq 676:740, ack 4495, win 469, options [nop,nop,TS val 3262340436 ecr 2731669831], length 64
00:07:52.250296 IP pote.home.53038 > par21s22-in-f10.1e100.net.https: Flags [P.], seq 740:910, ack 4495, win 469, options [nop,nop,TS val 3262340437 ecr 2731669831], length 170
00:07:52.250426 IP pote.home.53038 > par21s22-in-f10.1e100.net.https: Flags [P.], seq 910:1538, ack 4495, win 469, options [nop,nop,TS val 3262340437 ecr 2731669831], length 628
00:07:52.262518 IP par21s22-in-f10.1e100.net.https > pote.home.53038: Flags [P.], seq 4495:5109, ack 740, win 262, options [nop,nop,TS val 2731669850 ecr 3262340436], length 614
00:07:52.262519 IP par21s22-in-f10.1e100.net.https > pote.home.53038: Flags [P.], seq 5109:5140, ack 910, win 262, options [nop,nop,TS val 2731669850 ecr 3262340437], length 31
00:07:52.263624 IP pote.home.53038 > par21s22-in-f10.1e100.net.https: Flags [P.], seq 1538:1569, ack 5140, win 464, options [nop,nop,TS val 3262340450 ecr 2731669850], length 31
00:07:52.268673 IP par21s22-in-f10.1e100.net.https > pote.home.53038: Flags [.], ack 1538, win 262, options [nop,nop,TS val 2731669857 ecr 3262340437], length 0
00:07:52.271821 IP par21s22-in-f10.1e100.net.https > pote.home.53038: Flags [P.], seq 5140:5374, ack 1538, win 262, options [nop,nop,TS val 2731669860 ecr 3262340437], length 234
00:07:52.271822 IP par21s22-in-f10.1e100.net.https > pote.home.53038: Flags [P.], seq 5374:6558, ack 1538, win 262, options [nop,nop,TS val 2731669860 ecr 3262340437], length 1184
00:07:52.271822 IP par21s22-in-f10.1e100.net.https > pote.home.53038: Flags [P.], seq 6558:6597, ack 1538, win 262, options [nop,nop,TS val 2731669860 ecr 3262340437], length 39
00:07:52.272120 IP pote.home.53038 > par21s22-in-f10.1e100.net.https: Flags [.], ack 6597, win 453, options [nop,nop,TS val 3262340459 ecr 2731669860], length 0
00:07:52.272554 IP pote.home.53038 > par21s22-in-f10.1e100.net.https: Flags [P.], seq 1569:1608, ack 6597, win 453, options [nop,nop,TS val 3262340459 ecr 2731669860], length 39
00:07:52.272842 IP pote.home.53038 > par21s22-in-f10.1e100.net.https: Flags [FP.], seq 1608:1632, ack 6597, win 453, options [nop,nop,TS val 3262340459 ecr 2731669860], length 24
00:07:52.280909 IP par21s22-in-f10.1e100.net.https > pote.home.53038: Flags [.], ack 1569, win 262, options [nop,nop,TS val 2731669869 ecr 3262340450], length 0
00:07:52.284477 IP par21s22-in-f10.1e100.net.https > pote.home.53038: Flags [.], ack 1608, win 262, options [nop,nop,TS val 2731669872 ecr 3262340459], length 0
00:07:52.285210 IP par21s22-in-f10.1e100.net.https > pote.home.53038: Flags [F.], seq 6597, ack 1633, win 262, options [nop,nop,TS val 2731669873 ecr 3262340459], length 0
00:07:52.285416 IP pote.home.53038 > par21s22-in-f10.1e100.net.https: Flags [.], ack 6598, win 453, options [nop,nop,TS val 3262340472 ecr 2731669873], length 0
00:07:57.308682 ARP, Reply livebox.home is-at 44:d4:53:9d:92:d0 (oui Unknown), length 46
00:08:11.236530 IP6 fe80::6974:f16f:4d67:90c0.57868 > ff02::1:3.llmnr: UDP, length 33
00:08:11.236530 IP etg0124-gk.home.57868 > 224.0.0.252.llmnr: UDP, length 33
00:08:11.236530 IP6 fe80::6974:f16f:4d67:90c0.56069 > ff02::1:3.llmnr: UDP, length 33
00:08:11.539805 IP pc-29.home.60523 > 255.255.255.255.teradataordbms: UDP, length 20
00:08:11.539805 IP6 fe80::6974:f16f:4d67:90c0.57868 > ff02::1:3.llmnr: UDP, length 33
00:08:11.539805 IP etg0124-gk.home.57868 > 224.0.0.252.llmnr: UDP, length 33
00:08:11.539805 IP6 fe80::6974:f16f:4d67:90c0.56069 > ff02::1:3.llmnr: UDP, length 33
00:08:11.539806 IP etg0124-gk.home.56069 > 224.0.0.252.llmnr: UDP, length 33
00:08:12.157296 IP6 fe80::6974:f16f:4d67:90c0.58203 > ff02::1:3.llmnr: UDP, length 33
00:08:12.157296 IP etg0124-gk.home.58203 > 224.0.0.252.llmnr: UDP, length 33
00:08:12.157296 IP6 fe80::6974:f16f:4d67:90c0.51810 > ff02::1:3.llmnr: UDP, length 33
00:08:12.157296 IP etg0124-gk.home.51810 > 224.0.0.252.llmnr: UDP, length 33
00:08:12.768627 IP6 fe80::6974:f16f:4d67:90c0.58203 > ff02::1:3.llmnr: UDP, length 33
00:08:12.768628 IP etg0124-gk.home.58203 > 224.0.0.252.llmnr: UDP, length 33
00:08:12.768628 IP etg0124-gk.home.51810 > 224.0.0.252.llmnr: UDP, length 33
00:08:13.385467 IP6 fe80::6974:f16f:4d67:90c0.55827 > ff02::1:3.llmnr: UDP, length 33
00:08:13.385467 IP etg0124-gk.home.55827 > 224.0.0.252.llmnr: UDP, length 33
00:08:13.385467 IP6 fe80::6974:f16f:4d67:90c0.50033 > ff02::1:3.llmnr: UDP, length 33
00:08:13.385467 IP etg0124-gk.home.50033 > 224.0.0.252.llmnr: UDP, length 33
00:08:13.690743 IP6 fe80::6974:f16f:4d67:90c0.55827 > ff02::1:3.llmnr: UDP, length 33
00:08:13.690744 IP etg0124-gk.home.55827 > 224.0.0.252.llmnr: UDP, length 33
00:08:13.690744 IP6 fe80::6974:f16f:4d67:90c0.50033 > ff02::1:3.llmnr: UDP, length 33
00:08:13.690744 IP etg0124-gk.home.50033 > 224.0.0.252.llmnr: UDP, length 33
00:08:14.308362 IP6 fe80::6974:f16f:4d67:90c0.53390 > ff02::1:3.llmnr: UDP, length 33
00:08:14.308362 IP etg0124-gk.home.53390 > 224.0.0.252.llmnr: UDP, length 33
00:08:14.308362 IP6 fe80::6974:f16f:4d67:90c0.56944 > ff02::1:3.llmnr: UDP, length 33
00:08:14.308972 IP etg0124-gk.home.56944 > 224.0.0.252.llmnr: UDP, length 33
00:08:14.308972 IP6 fe80::6974:f16f:4d67:90c0.49555 > ff02::1:3.llmnr: UDP, length 33
00:08:14.308972 IP etg0124-gk.home.49555 > 224.0.0.252.llmnr: UDP, length 33
00:08:14.309295 IP6 fe80::6974:f16f:4d67:90c0.51177 > ff02::1:3.llmnr: UDP, length 33
00:08:14.309295 IP etg0124-gk.home.51177 > 224.0.0.252.llmnr: UDP, length 33
00:08:14.918938 IP etg0124-gk.home.49555 > 224.0.0.252.llmnr: UDP, length 33
00:08:14.918939 IP6 fe80::6974:f16f:4d67:90c0.51177 > ff02::1:3.llmnr: UDP, length 33
00:08:27.106644 IP livebox.home > all-systems.mcast.net: igmp query v2
00:08:28.743031 IP pc-13.home > 224.0.0.252: igmp v2 report 224.0.0.252
00:08:40.109142 44:d4:53:9d:92:d0 (oui Unknown) > Broadcast, ethertype Unknown (0x88e1), length 60: 
	0x0000:  0120 6000 0000 0000 0000 0000 0000 0000  ..`.............
	0x0010:  0000 0000 0000 0000 0000 0000 0000 0000  ................
	0x0020:  0000 0000 0000 0000 0000 0000 0000       ..............
00:08:41.952227 IP pc-29.home.60524 > 255.255.255.255.teradataordbms: UDP, length 20
00:08:44.716906 44:d4:53:9d:92:d0 (oui Unknown) > Broadcast, ethertype Unknown (0x887b), length 60: 
	0x0000:  0102 0400 0487 1000 0000 0000 0000 0000  ................
	0x0010:  0000 0000 0000 0000 0000 0000 0000 0000  ................
	0x0020:  0000 0000 0000 0000 0000 0000 0000       ..............
00:08:49.327364 IP6 fe80::dc8b:7e8c:3540:d0b6.52950 > ff02::1:3.llmnr: UDP, length 33
00:08:49.327364 IP pc-13.home.52950 > 224.0.0.252.llmnr: UDP, length 33
00:08:49.328013 IP6 fe80::dc8b:7e8c:3540:d0b6.64205 > ff02::1:3.llmnr: UDP, length 33
00:08:49.328013 IP pc-13.home.64205 > 224.0.0.252.llmnr: UDP, length 33
00:08:49.635085 IP6 fe80::dc8b:7e8c:3540:d0b6.60773 > ff02::1:3.llmnr: UDP, length 33
00:08:49.635085 IP pc-13.home.60773 > 224.0.0.252.llmnr: UDP, length 33
00:08:49.635757 IP6 fe80::dc8b:7e8c:3540:d0b6.60884 > ff02::1:3.llmnr: UDP, length 33
00:08:49.635757 IP pc-13.home.60884 > 224.0.0.252.llmnr: UDP, length 33
00:08:49.940302 IP6 fe80::dc8b:7e8c:3540:d0b6.60884 > ff02::1:3.llmnr: UDP, length 33
00:08:49.940303 IP6 fe80::dc8b:7e8c:3540:d0b6.60773 > ff02::1:3.llmnr: UDP, length 33
00:08:49.940303 IP pc-13.home.60884 > 224.0.0.252.llmnr: UDP, length 33
00:08:50.556699 IP pc-13.home.64027 > 224.0.0.252.llmnr: UDP, length 33
00:08:50.557291 IP6 fe80::dc8b:7e8c:3540:d0b6.53514 > ff02::1:3.llmnr: UDP, length 33
00:08:50.557291 IP pc-13.home.53514 > 224.0.0.252.llmnr: UDP, length 33
00:08:50.866550 IP6 fe80::dc8b:7e8c:3540:d0b6.64027 > ff02::1:3.llmnr: UDP, length 33
00:08:50.866551 IP6 fe80::dc8b:7e8c:3540:d0b6.53514 > ff02::1:3.llmnr: UDP, length 33
00:08:50.866551 IP pc-13.home.53514 > 224.0.0.252.llmnr: UDP, length 33
00:09:06.938937 IP livebox.home > all-systems.mcast.net: igmp query v2
00:09:08.680131 IP pc-13.home > 224.0.0.252: igmp v2 report 224.0.0.252
00:09:12.672604 IP pc-29.home.60525 > 255.255.255.255.teradataordbms: UDP, length 20
00:09:14.823331 44:d4:53:9d:92:d0 (oui Unknown) > Broadcast, ethertype Unknown (0x887b), length 60: 
	0x0000:  0102 0400 0487 1000 0000 0000 0000 0000  ................
	0x0010:  0000 0000 0000 0000 0000 0000 0000 0000  ................
	0x0020:  0000 0000 0000 0000 0000 0000 0000       ..............
00:09:33.870478 IP6 fe80::46d4:53ff:fe9d:92d0 > ff02::1: ICMP6, echo request, id 14083, seq 0, length 64
00:09:40.014257 44:d4:53:9d:92:d0 (oui Unknown) > Broadcast, ethertype Unknown (0x88e1), length 60: 
	0x0000:  0120 6000 0000 0000 0000 0000 0000 0000  ..`.............
	0x0010:  0000 0000 0000 0000 0000 0000 0000 0000  ................
	0x0020:  0000 0000 0000 0000 0000 0000 0000       ..............
00:09:44.622393 44:d4:53:9d:92:d0 (oui Unknown) > Broadcast, ethertype Unknown (0x887b), length 60: 
	0x0000:  0102 0400 0487 1000 0000 0000 0000 0000  ................
	0x0010:  0000 0000 0000 0000 0000 0000 0000 0000  ................
	0x0020:  0000 0000 0000 0000 0000 0000 0000       ..............
00:09:47.082758 IP livebox.home > all-systems.mcast.net: igmp query v2
00:10:01.211638 ARP, Reply pote.home is-at 0c:7a:15:cb:45:fd (oui Unknown), length 28
00:10:01.518549 ARP, Reply pote.home is-at 0c:7a:15:cb:45:fd (oui Unknown), length 28
00:10:13.499585 IP pc-29.home.60527 > 255.255.255.255.teradataordbms: UDP, length 20
00:10:14.728796 44:d4:53:9d:92:d0 (oui Unknown) > Broadcast, ethertype Unknown (0x887b), length 60: 
	0x0000:  0102 0400 0487 1000 0000 0000 0000 0000  ................
	0x0010:  0000 0000 0000 0000 0000 0000 0000 0000  ................
	0x0020:  0000 0000 0000 0000 0000 0000 0000       ..............
00:10:27.121642 IP livebox.home > all-systems.mcast.net: igmp query v2
00:10:29.781669 IP poste1-pc.home > 224.0.0.252: igmp v2 report 224.0.0.252
00:10:40.226504 IP 192.168.1.123.netbios-dgm > 192.168.1.255.netbios-dgm: UDP, length 201
00:10:44.220931 IP pc-29.home.60528 > 255.255.255.255.teradataordbms: UDP, length 20
00:10:44.834853 44:d4:53:9d:92:d0 (oui Unknown) > Broadcast, ethertype Unknown (0x887b), length 60: 
	0x0000:  0102 0400 0487 1000 0000 0000 0000 0000  ................
	0x0010:  0000 0000 0000 0000 0000 0000 0000 0000  ................
	0x0020:  0000 0000 0000 0000 0000 0000 0000       ..............
00:10:50.671281 IP 192.168.1.123.netbios-dgm > 192.168.1.255.netbios-dgm: UDP, length 201
00:10:54.360501 IP pc-13.home.netbios-ns > 192.168.1.255.netbios-ns: UDP, length 50
00:10:54.360502 IP6 fe80::dc8b:7e8c:3540:d0b6.50955 > ff02::1:3.llmnr: UDP, length 25
00:10:54.360502 IP pc-13.home.50955 > 224.0.0.252.llmnr: UDP, length 25
00:10:54.360503 IP6 fe80::dc8b:7e8c:3540:d0b6.60590 > ff02::1:3.llmnr: UDP, length 25
00:10:54.361235 IP pc-13.home.60590 > 224.0.0.252.llmnr: UDP, length 25
00:10:54.361235 IP pc-13.home.netbios-dgm > 192.168.1.255.netbios-dgm: UDP, length 174
00:10:54.361235 IP pc-13.home.netbios-ns > 192.168.1.255.netbios-ns: UDP, length 50
00:10:56.508283 IP pc-13.home.netbios-dgm > 192.168.1.255.netbios-dgm: UDP, length 174
00:10:56.508284 IP pc-13.home.netbios-ns > 192.168.1.255.netbios-ns: UDP, length 50
00:10:57.430174 IP pc-13.home.netbios-ns > 192.168.1.255.netbios-ns: UDP, length 50
00:10:58.661242 IP etg0124-gk.home.netbios-ns > 192.168.1.255.netbios-ns: UDP, length 50
00:10:59.580534 IP etg0124-gk.home.netbios-ns > 192.168.1.255.netbios-ns: UDP, length 50
00:11:00.501937 IP etg0124-gk.home.netbios-ns > 192.168.1.255.netbios-ns: UDP, length 50
00:11:01.117092 IP etg0124-gk.home.netbios-dgm > 192.168.1.255.netbios-dgm: UDP, length 174
00:11:01.117092 IP etg0124-gk.home.netbios-ns > 192.168.1.255.netbios-ns: UDP, length 50
00:11:01.730669 IP 192.168.1.123.netbios-dgm > 192.168.1.255.netbios-dgm: UDP, length 201
00:11:02.038085 IP etg0124-gk.home.netbios-ns > 192.168.1.255.netbios-ns: UDP, length 50
00:11:02.652546 IP etg0124-gk.home.netbios-ns > 192.168.1.255.netbios-ns: UDP, length 50
00:11:06.953530 IP livebox.home > all-systems.mcast.net: igmp query v2
00:11:08.797565 IP poste1-pc.home > 224.0.0.252: igmp v2 report 224.0.0.252
00:11:14.633201 IP pc-29.home.60529 > 255.255.255.255.teradataordbms: UDP, length 20
00:11:14.633202 44:d4:53:9d:92:d0 (oui Unknown) > Broadcast, ethertype Unknown (0x887b), length 60: 
	0x0000:  0102 0400 0487 1000 0000 0000 0000 0000  ................
	0x0010:  0000 0000 0000 0000 0000 0000 0000 0000  ................
	0x0020:  0000 0000 0000 0000 0000 0000 0000       ..............
00:11:33.680550 IP6 fe80::46d4:53ff:fe9d:92d0 > ff02::1: ICMP6, echo request, id 14083, seq 0, length 64
00:11:40.131618 44:d4:53:9d:92:d0 (oui Unknown) > Broadcast, ethertype Unknown (0x88e1), length 60: 
	0x0000:  0120 6000 0000 0000 0000 0000 0000 0000  ..`.............
	0x0010:  0000 0000 0000 0000 0000 0000 0000 0000  ................
	0x0020:  0000 0000 0000 0000 0000 0000 0000       ..............
00:11:42.593867 IP6 fe80::dc8b:7e8c:3540:d0b6.58915 > ff02::1:3.llmnr: UDP, length 33
00:11:42.593867 IP pc-13.home.58915 > 224.0.0.252.llmnr: UDP, length 33
00:11:42.594517 IP6 fe80::dc8b:7e8c:3540:d0b6.57775 > ff02::1:3.llmnr: UDP, length 33
00:11:42.594517 IP pc-13.home.57775 > 224.0.0.252.llmnr: UDP, length 33
00:11:42.594818 IP6 fe80::dc8b:7e8c:3540:d0b6.53502 > ff02::1:3.llmnr: UDP, length 33
00:11:42.594818 IP pc-13.home.53502 > 224.0.0.252.llmnr: UDP, length 33
00:11:42.594818 IP6 fe80::dc8b:7e8c:3540:d0b6.50270 > ff02::1:3.llmnr: UDP, length 33
00:11:42.594818 IP pc-13.home.50270 > 224.0.0.252.llmnr: UDP, length 33
00:11:43.204369 IP6 fe80::dc8b:7e8c:3540:d0b6.50270 > ff02::1:3.llmnr: UDP, length 33
00:11:43.204369 IP6 fe80::dc8b:7e8c:3540:d0b6.53502 > ff02::1:3.llmnr: UDP, length 33
00:11:43.204369 IP pc-13.home.50270 > 224.0.0.252.llmnr: UDP, length 33
00:11:43.204369 IP pc-13.home.53502 > 224.0.0.252.llmnr: UDP, length 33
00:11:43.821149 IP6 fe80::dc8b:7e8c:3540:d0b6.54904 > ff02::1:3.llmnr: UDP, length 33
00:11:43.821149 IP pc-13.home.54904 > 224.0.0.252.llmnr: UDP, length 33
00:11:43.821149 IP6 fe80::dc8b:7e8c:3540:d0b6.50168 > ff02::1:3.llmnr: UDP, length 33
00:11:43.821149 IP pc-13.home.50168 > 224.0.0.252.llmnr: UDP, length 33
00:11:44.126022 IP6 fe80::dc8b:7e8c:3540:d0b6.50168 > ff02::1:3.llmnr: UDP, length 33
00:11:44.126023 IP pc-13.home.50168 > 224.0.0.252.llmnr: UDP, length 33
00:11:44.126023 IP pc-13.home.54904 > 224.0.0.252.llmnr: UDP, length 33
00:11:44.740114 44:d4:53:9d:92:d0 (oui Unknown) > Broadcast, ethertype Unknown (0x887b), length 60: 
	0x0000:  0102 0400 0487 1000 0000 0000 0000 0000  ................
	0x0010:  0000 0000 0000 0000 0000 0000 0000 0000  ................
	0x0020:  0000 0000 0000 0000 0000 0000 0000       ..............
00:11:45.046825 IP pc-29.home.60530 > 255.255.255.255.teradataordbms: UDP, length 20
00:11:47.200165 IP livebox.home > all-systems.mcast.net: igmp query v2
00:11:49.654759 IP pc-13.home.netbios-dgm > 192.168.1.255.netbios-dgm: UDP, length 201
00:11:49.962326 IP 192.168.1.123 > 224.0.0.252: igmp v2 report 224.0.0.252
00:12:02.250574 ARP, Reply pote.home is-at 0c:7a:15:cb:45:fd (oui Unknown), length 28
00:12:02.557735 ARP, Reply pote.home is-at 0c:7a:15:cb:45:fd (oui Unknown), length 28
00:12:13.312029 IP6 fe80::6974:f16f:4d67:90c0.64867 > ff02::1:3.llmnr: UDP, length 33
00:12:13.312030 IP etg0124-gk.home.64867 > 224.0.0.252.llmnr: UDP, length 33
00:12:13.312723 IP6 fe80::6974:f16f:4d67:90c0.49174 > ff02::1:3.llmnr: UDP, length 33
00:12:13.312723 IP etg0124-gk.home.49174 > 224.0.0.252.llmnr: UDP, length 33
00:12:13.619293 IP6 fe80::6974:f16f:4d67:90c0.55719 > ff02::1:3.llmnr: UDP, length 33
00:12:13.619293 IP etg0124-gk.home.55719 > 224.0.0.252.llmnr: UDP, length 33
00:12:13.619293 IP6 fe80::6974:f16f:4d67:90c0.56156 > ff02::1:3.llmnr: UDP, length 33
00:12:13.619885 IP etg0124-gk.home.56156 > 224.0.0.252.llmnr: UDP, length 33
00:12:13.925197 IP6 fe80::6974:f16f:4d67:90c0.56156 > ff02::1:3.llmnr: UDP, length 33
00:12:13.925198 IP etg0124-gk.home.56156 > 224.0.0.252.llmnr: UDP, length 33
00:12:13.925198 IP6 fe80::6974:f16f:4d67:90c0.55719 > ff02::1:3.llmnr: UDP, length 33
00:12:13.925198 IP etg0124-gk.home.55719 > 224.0.0.252.llmnr: UDP, length 33
00:12:14.542345 IP6 fe80::6974:f16f:4d67:90c0.61576 > ff02::1:3.llmnr: UDP, length 33
00:12:14.542345 IP etg0124-gk.home.61576 > 224.0.0.252.llmnr: UDP, length 33
00:12:14.542345 IP6 fe80::6974:f16f:4d67:90c0.61338 > ff02::1:3.llmnr: UDP, length 33
00:12:14.542346 IP etg0124-gk.home.61338 > 224.0.0.252.llmnr: UDP, length 33
00:12:14.845524 44:d4:53:9d:92:d0 (oui Unknown) > Broadcast, ethertype Unknown (0x887b), length 60: 
	0x0000:  0102 0400 0487 1000 0000 0000 0000 0000  ................
	0x0010:  0000 0000 0000 0000 0000 0000 0000 0000  ................
	0x0020:  0000 0000 0000 0000 0000 0000 0000       ..............
00:12:15.153757 IP6 fe80::6974:f16f:4d67:90c0.61576 > ff02::1:3.llmnr: UDP, length 33
00:12:15.153758 IP etg0124-gk.home.61576 > 224.0.0.252.llmnr: UDP, length 33
00:12:15.153758 IP6 fe80::6974:f16f:4d67:90c0.61338 > ff02::1:3.llmnr: UDP, length 33
00:12:15.153758 IP etg0124-gk.home.61338 > 224.0.0.252.llmnr: UDP, length 33
00:12:15.463282 IP6 fe80::6974:f16f:4d67:90c0.61645 > ff02::1:3.llmnr: UDP, length 33
00:12:15.463282 IP etg0124-gk.home.61645 > 224.0.0.252.llmnr: UDP, length 33
00:12:15.463283 IP6 fe80::6974:f16f:4d67:90c0.62093 > ff02::1:3.llmnr: UDP, length 33
00:12:15.463283 IP etg0124-gk.home.62093 > 224.0.0.252.llmnr: UDP, length 33
00:12:15.767237 IP pc-29.home.60531 > 255.255.255.255.teradataordbms: UDP, length 20
00:12:16.075226 IP6 fe80::6974:f16f:4d67:90c0.61645 > ff02::1:3.llmnr: UDP, length 33
00:12:16.075226 IP etg0124-gk.home.61645 > 224.0.0.252.llmnr: UDP, length 33
00:12:16.075226 IP6 fe80::6974:f16f:4d67:90c0.62093 > ff02::1:3.llmnr: UDP, length 33
00:12:16.075226 IP etg0124-gk.home.62093 > 224.0.0.252.llmnr: UDP, length 33
00:12:16.693091 IP6 fe80::6974:f16f:4d67:90c0.53426 > ff02::1:3.llmnr: UDP, length 33
00:12:16.693091 IP etg0124-gk.home.53426 > 224.0.0.252.llmnr: UDP, length 33
00:12:16.693091 IP6 fe80::6974:f16f:4d67:90c0.54145 > ff02::1:3.llmnr: UDP, length 33
00:12:16.693091 IP etg0124-gk.home.54145 > 224.0.0.252.llmnr: UDP, length 33
00:12:16.997307 IP6 fe80::6974:f16f:4d67:90c0.53426 > ff02::1:3.llmnr: UDP, length 33
00:12:16.997308 IP etg0124-gk.home.53426 > 224.0.0.252.llmnr: UDP, length 33
00:12:16.997308 IP6 fe80::6974:f16f:4d67:90c0.54145 > ff02::1:3.llmnr: UDP, length 33
00:12:16.997308 IP etg0124-gk.home.54145 > 224.0.0.252.llmnr: UDP, length 33
00:12:17.613306 IP etg0124-gk.home.53799 > 224.0.0.252.llmnr: UDP, length 33
00:12:17.613982 IP6 fe80::6974:f16f:4d67:90c0.52751 > ff02::1:3.llmnr: UDP, length 33
00:12:17.613982 IP etg0124-gk.home.52751 > 224.0.0.252.llmnr: UDP, length 33
00:12:17.918856 IP6 fe80::6974:f16f:4d67:90c0.52751 > ff02::1:3.llmnr: UDP, length 33
00:12:17.918856 IP etg0124-gk.home.52751 > 224.0.0.252.llmnr: UDP, length 33
00:12:17.918857 IP6 fe80::6974:f16f:4d67:90c0.53799 > ff02::1:3.llmnr: UDP, length 33
00:12:17.918857 IP etg0124-gk.home.53799 > 224.0.0.252.llmnr: UDP, length 33
00:12:27.238899 IP livebox.home > all-systems.mcast.net: igmp query v2
00:12:39.729867 IP ic-418-4745.home.netbios-ns > 192.168.1.255.netbios-ns: UDP, length 50
00:12:39.729868 IP ic-418-4745.home.netbios-ns > 192.168.1.255.netbios-ns: UDP, length 50
00:12:40.036461 44:d4:53:9d:92:d0 (oui Unknown) > Broadcast, ethertype Unknown (0x88e1), length 60: 
	0x0000:  0120 6000 0000 0000 0000 0000 0000 0000  ..`.............
	0x0010:  0000 0000 0000 0000 0000 0000 0000 0000  ................
	0x0020:  0000 0000 0000 0000 0000 0000 0000       ..............
00:12:44.644624 44:d4:53:9d:92:d0 (oui Unknown) > Broadcast, ethertype Unknown (0x887b), length 60: 
	0x0000:  0102 0400 0487 1000 0000 0000 0000 0000  ................
	0x0010:  0000 0000 0000 0000 0000 0000 0000 0000  ................
	0x0020:  0000 0000 0000 0000 0000 0000 0000       ..............
00:12:46.180740 IP pc-29.home.60532 > 255.255.255.255.teradataordbms: UDP, length 20
00:12:51.714480 IP6 fe80::dc8b:7e8c:3540:d0b6.54258 > ff02::1:3.llmnr: UDP, length 33
00:12:51.714480 IP pc-13.home.54258 > 224.0.0.252.llmnr: UDP, length 33
00:12:51.715146 IP6 fe80::dc8b:7e8c:3540:d0b6.49250 > ff02::1:3.llmnr: UDP, length 33
00:12:51.715146 IP pc-13.home.49250 > 224.0.0.252.llmnr: UDP, length 33
00:12:51.715444 IP6 fe80::dc8b:7e8c:3540:d0b6.65523 > ff02::1:3.llmnr: UDP, length 33
00:12:51.715444 IP pc-13.home.65523 > 224.0.0.252.llmnr: UDP, length 33
00:12:51.715525 IP6 fe80::dc8b:7e8c:3540:d0b6.56672 > ff02::1:3.llmnr: UDP, length 33
00:12:51.715525 IP pc-13.home.56672 > 224.0.0.252.llmnr: UDP, length 33
00:12:52.325411 IP6 fe80::dc8b:7e8c:3540:d0b6.65523 > ff02::1:3.llmnr: UDP, length 33
00:12:52.325412 IP6 fe80::dc8b:7e8c:3540:d0b6.56672 > ff02::1:3.llmnr: UDP, length 33
00:12:52.325412 IP pc-13.home.56672 > 224.0.0.252.llmnr: UDP, length 33
00:12:52.325412 IP pc-13.home.65523 > 224.0.0.252.llmnr: UDP, length 33
00:12:52.943491 IP6 fe80::dc8b:7e8c:3540:d0b6.54247 > ff02::1:3.llmnr: UDP, length 33
00:12:52.943491 IP pc-13.home.54247 > 224.0.0.252.llmnr: UDP, length 33
00:12:52.943491 IP6 fe80::dc8b:7e8c:3540:d0b6.51479 > ff02::1:3.llmnr: UDP, length 33
00:12:52.943491 IP pc-13.home.51479 > 224.0.0.252.llmnr: UDP, length 33
00:12:53.247012 IP6 fe80::dc8b:7e8c:3540:d0b6.51479 > ff02::1:3.llmnr: UDP, length 33
00:12:53.247013 IP6 fe80::dc8b:7e8c:3540:d0b6.54247 > ff02::1:3.llmnr: UDP, length 33
00:12:53.247013 IP pc-13.home.54247 > 224.0.0.252.llmnr: UDP, length 33
00:12:53.247013 IP pc-13.home.51479 > 224.0.0.252.llmnr: UDP, length 33
00:12:59.392120 IP 192.168.1.13.netbios-dgm > 192.168.1.15.netbios-dgm: UDP, length 201
00:13:07.076344 IP livebox.home > all-systems.mcast.net: igmp query v2
00:13:08.299212 IP 192.168.1.123 > 224.0.0.252: igmp v2 report 224.0.0.252
00:13:09.528384 IP 192.168.1.13.netbios-dgm > 192.168.1.15.netbios-dgm: UDP, length 201
00:13:14.750897 44:d4:53:9d:92:d0 (oui Unknown) > Broadcast, ethertype Unknown (0x887b), length 60: 
	0x0000:  0102 0400 0487 1000 0000 0000 0000 0000  ................
	0x0010:  0000 0000 0000 0000 0000 0000 0000 0000  ................
	0x0020:  0000 0000 0000 0000 0000 0000 0000       ..............
00:13:16.594105 IP pc-29.home.60533 > 255.255.255.255.teradataordbms: UDP, length 20
00:13:20.587507 IP 192.168.1.13.netbios-dgm > 192.168.1.15.netbios-dgm: UDP, length 201
00:13:33.797581 IP6 fe80::46d4:53ff:fe9d:92d0 > ff02::1: ICMP6, echo request, id 14083, seq 0, length 64
00:13:40.248861 44:d4:53:9d:92:d0 (oui Unknown) > Broadcast, ethertype Unknown (0x88e1), length 60: 
	0x0000:  0120 6000 0000 0000 0000 0000 0000 0000  ..`.............
	0x0010:  0000 0000 0000 0000 0000 0000 0000 0000  ................
	0x0020:  0000 0000 0000 0000 0000 0000 0000       ..............
00:13:44.856978 44:d4:53:9d:92:d0 (oui Unknown) > Broadcast, ethertype Unknown (0x887b), length 60: 
	0x0000:  0102 0400 0487 1000 0000 0000 0000 0000  ................
	0x0010:  0000 0000 0000 0000 0000 0000 0000 0000  ................
	0x0020:  0000 0000 0000 0000 0000 0000 0000       ..............
00:13:47.007945 IP livebox.home > all-systems.mcast.net: igmp query v2
00:13:47.315034 IP pc-29.home.60534 > 255.255.255.255.teradataordbms: UDP, length 20
00:14:03.595982 ARP, Reply pote.home is-at 0c:7a:15:cb:45:fd (oui Unknown), length 28
00:14:03.903499 ARP, Reply pote.home is-at 0c:7a:15:cb:45:fd (oui Unknown), length 28
00:14:14.655672 44:d4:53:9d:92:d0 (oui Unknown) > Broadcast, ethertype Unknown (0x887b), length 60: 
	0x0000:  0102 0400 0487 1000 0000 0000 0000 0000  ................
	0x0010:  0000 0000 0000 0000 0000 0000 0000 0000  ................
	0x0020:  0000 0000 0000 0000 0000 0000 0000       ..............
00:14:17.727821 IP pc-29.home.60764 > 255.255.255.255.teradataordbms: UDP, length 20
00:14:26.946851 IP livebox.home > all-systems.mcast.net: igmp query v2
00:14:27.865875 IP 192.168.1.123 > 224.0.0.252: igmp v2 report 224.0.0.252
00:14:34.933480 IP etg0124-gk.home.netbios-dgm > 192.168.1.255.netbios-dgm: UDP, length 201
00:14:40.155631 44:d4:53:9d:92:d0 (oui Unknown) > Broadcast, ethertype Unknown (0x88e1), length 60: 
	0x0000:  0120 6000 0000 0000 0000 0000 0000 0000  ..`.............
	0x0010:  0000 0000 0000 0000 0000 0000 0000 0000  ................
	0x0020:  0000 0000 0000 0000 0000 0000 0000       ..............
00:14:44.761880 44:d4:53:9d:92:d0 (oui Unknown) > Broadcast, ethertype Unknown (0x887b), length 60: 
	0x0000:  0102 0400 0487 1000 0000 0000 0000 0000  ................
	0x0010:  0000 0000 0000 0000 0000 0000 0000 0000  ................
	0x0020:  0000 0000 0000 0000 0000 0000 0000       ..............
00:14:48.141249 IP pc-29.home.60765 > 255.255.255.255.teradataordbms: UDP, length 20
00:15:07.088175 IP livebox.home > all-systems.mcast.net: igmp query v2
00:15:08.416736 IP 192.168.1.71 > 224.0.0.252: igmp v2 report 224.0.0.252
00:15:14.868308 44:d4:53:9d:92:d0 (oui Unknown) > Broadcast, ethertype Unknown (0x887b), length 60: 
	0x0000:  0102 0400 0487 1000 0000 0000 0000 0000  ................
	0x0010:  0000 0000 0000 0000 0000 0000 0000 0000  ................
	0x0020:  0000 0000 0000 0000 0000 0000 0000       ..............
00:15:18.861628 IP pc-29.home.60766 > 255.255.255.255.teradataordbms: UDP, length 20
00:15:31.154240 IP poste1-pc.home.netbios-ns > 192.168.1.255.netbios-ns: UDP, length 50
00:15:31.154962 IP6 fe80::575d:b4b9:6f8e:9ab2.51725 > ff02::1:3.llmnr: UDP, length 25
00:15:31.154962 IP poste1-pc.home.51725 > 224.0.0.252.llmnr: UDP, length 25
00:15:31.154962 IP poste1-pc.home.60394 > 224.0.0.252.llmnr: UDP, length 25
00:15:31.154963 IP poste1-pc.home.netbios-ns > 192.168.1.255.netbios-ns: UDP, length 50
00:15:31.157456 IP6 fe80::575d:b4b9:6f8e:9ab2.64788 > ff02::1:3.llmnr: UDP, length 33
00:15:31.157456 IP poste1-pc.home.64788 > 224.0.0.252.llmnr: UDP, length 33
00:15:31.157456 IP6 fe80::575d:b4b9:6f8e:9ab2.49610 > ff02::1:3.llmnr: UDP, length 33
00:15:31.162060 IP6 fe80::575d:b4b9:6f8e:9ab2.57524 > ff02::1:3.llmnr: UDP, length 33
00:15:31.162061 IP poste1-pc.home.57524 > 224.0.0.252.llmnr: UDP, length 33
00:15:31.162061 IP6 fe80::575d:b4b9:6f8e:9ab2.58848 > ff02::1:3.llmnr: UDP, length 33
00:15:31.162061 IP poste1-pc.home.58848 > 224.0.0.252.llmnr: UDP, length 33
00:15:31.162711 IP6 fe80::575d:b4b9:6f8e:9ab2.60334 > ff02::1:3.llmnr: UDP, length 33
00:15:31.162711 IP poste1-pc.home.60334 > 224.0.0.252.llmnr: UDP, length 33
00:15:31.162711 IP6 fe80::575d:b4b9:6f8e:9ab2.51112 > ff02::1:3.llmnr: UDP, length 33
00:15:31.162711 IP poste1-pc.home.51112 > 224.0.0.252.llmnr: UDP, length 33
00:15:31.162711 IP poste1-pc.home.netbios-ns > 192.168.1.255.netbios-ns: UDP, length 50
00:15:31.163424 IP6 fe80::575d:b4b9:6f8e:9ab2.53346 > ff02::1:3.llmnr: UDP, length 33
00:15:31.163424 IP poste1-pc.home.53346 > 224.0.0.252.llmnr: UDP, length 33
00:15:31.166553 IP6 fe80::575d:b4b9:6f8e:9ab2.56850 > ff02::1:3.llmnr: UDP, length 33
00:15:31.166553 IP poste1-pc.home.56850 > 224.0.0.252.llmnr: UDP, length 33
00:15:31.166553 IP poste1-pc.home.netbios-ns > 192.168.1.255.netbios-ns: UDP, length 50
00:15:31.166814 IP6 fe80::575d:b4b9:6f8e:9ab2.49372 > ff02::1:3.llmnr: UDP, length 33
00:15:31.166814 IP poste1-pc.home.49372 > 224.0.0.252.llmnr: UDP, length 33
00:15:31.166814 IP6 fe80::575d:b4b9:6f8e:9ab2.54601 > ff02::1:3.llmnr: UDP, length 33
00:15:31.166814 IP poste1-pc.home.54601 > 224.0.0.252.llmnr: UDP, length 33
00:15:31.459148 IP6 fe80::575d:b4b9:6f8e:9ab2.65276 > ff02::1:3.llmnr: UDP, length 33
00:15:31.459148 IP poste1-pc.home.65276 > 224.0.0.252.llmnr: UDP, length 33
00:15:31.459149 IP6 fe80::575d:b4b9:6f8e:9ab2.63167 > ff02::1:3.llmnr: UDP, length 33
00:15:31.459149 IP poste1-pc.home.63167 > 224.0.0.252.llmnr: UDP, length 33
00:15:31.462385 IP6 fe80::575d:b4b9:6f8e:9ab2.49815 > ff02::1:3.llmnr: UDP, length 33
00:15:31.462675 IP6 fe80::575d:b4b9:6f8e:9ab2.51424 > ff02::1:3.llmnr: UDP, length 33
00:15:31.462676 IP poste1-pc.home.51424 > 224.0.0.252.llmnr: UDP, length 33
00:15:31.462676 IP poste1-pc.home.netbios-ns > 192.168.1.255.netbios-ns: UDP, length 50
00:15:31.468132 IP6 fe80::575d:b4b9:6f8e:9ab2.50407 > ff02::1:3.llmnr: UDP, length 33
00:15:31.468132 IP poste1-pc.home.50407 > 224.0.0.252.llmnr: UDP, length 33
00:15:31.468132 IP6 fe80::575d:b4b9:6f8e:9ab2.53663 > ff02::1:3.llmnr: UDP, length 33
00:15:31.468132 IP poste1-pc.home.53663 > 224.0.0.252.llmnr: UDP, length 33
00:15:31.468132 IP poste1-pc.home.netbios-ns > 192.168.1.255.netbios-ns: UDP, length 50
00:15:31.468807 IP6 fe80::575d:b4b9:6f8e:9ab2.57515 > ff02::1:3.llmnr: UDP, length 28
00:15:31.469092 IP6 fe80::575d:b4b9:6f8e:9ab2.64927 > ff02::1:3.llmnr: UDP, length 28
00:15:31.469093 IP poste1-pc.home.64927 > 224.0.0.252.llmnr: UDP, length 28
00:15:31.475878 IP6 fe80::575d:b4b9:6f8e:9ab2.51552 > ff02::1:3.llmnr: UDP, length 28
00:15:31.475878 IP poste1-pc.home.51552 > 224.0.0.252.llmnr: UDP, length 28
00:15:31.475878 IP6 fe80::575d:b4b9:6f8e:9ab2.61205 > ff02::1:3.llmnr: UDP, length 28
00:15:31.475879 IP poste1-pc.home.61205 > 224.0.0.252.llmnr: UDP, length 28
00:15:31.476478 IP6 fe80::575d:b4b9:6f8e:9ab2.51816 > ff02::1:3.llmnr: UDP, length 28
00:15:31.476773 IP poste1-pc.home.51816 > 224.0.0.252.llmnr: UDP, length 28
00:15:31.476773 IP6 fe80::575d:b4b9:6f8e:9ab2.60268 > ff02::1:3.llmnr: UDP, length 28
00:15:31.476773 IP poste1-pc.home.60268 > 224.0.0.252.llmnr: UDP, length 28
00:15:31.476773 IP poste1-pc.home.netbios-ns > 192.168.1.255.netbios-ns: UDP, length 50
00:15:31.477057 IP poste1-pc.home.52837 > 224.0.0.252.llmnr: UDP, length 28
00:15:31.477057 IP poste1-pc.home.60424 > 224.0.0.252.llmnr: UDP, length 28
00:15:31.477057 IP poste1-pc.home.netbios-ns > 192.168.1.255.netbios-ns: UDP, length 50
00:15:31.477274 IP6 fe80::575d:b4b9:6f8e:9ab2.62304 > ff02::1:3.llmnr: UDP, length 33
00:15:31.477274 IP poste1-pc.home.62304 > 224.0.0.252.llmnr: UDP, length 33
00:15:31.478599 IP6 fe80::575d:b4b9:6f8e:9ab2.55558 > ff02::1:3.llmnr: UDP, length 33
00:15:31.478600 IP poste1-pc.home.55558 > 224.0.0.252.llmnr: UDP, length 33
00:15:31.766277 IP6 fe80::575d:b4b9:6f8e:9ab2.62304 > ff02::1:3.llmnr: UDP, length 33
00:15:31.766278 IP poste1-pc.home.62304 > 224.0.0.252.llmnr: UDP, length 33
00:15:31.766278 IP poste1-pc.home.55558 > 224.0.0.252.llmnr: UDP, length 33
00:15:33.915086 IP6 fe80::46d4:53ff:fe9d:92d0 > ff02::1: ICMP6, echo request, id 14083, seq 0, length 64
00:15:40.058714 44:d4:53:9d:92:d0 (oui Unknown) > Broadcast, ethertype Unknown (0x88e1), length 60: 
	0x0000:  0120 6000 0000 0000 0000 0000 0000 0000  ..`.............
	0x0010:  0000 0000 0000 0000 0000 0000 0000 0000  ................
	0x0020:  0000 0000 0000 0000 0000 0000 0000       ..............
00:15:44.666862 44:d4:53:9d:92:d0 (oui Unknown) > Broadcast, ethertype Unknown (0x887b), length 60: 
	0x0000:  0102 0400 0487 1000 0000 0000 0000 0000  ................
	0x0010:  0000 0000 0000 0000 0000 0000 0000 0000  ................
	0x0020:  0000 0000 0000 0000 0000 0000 0000       ..............
00:15:44.978807 IP6 fe80::dc8b:7e8c:3540:d0b6.51038 > ff02::1:3.llmnr: UDP, length 33
00:15:44.978807 IP pc-13.home.51038 > 224.0.0.252.llmnr: UDP, length 33
00:15:44.979510 IP6 fe80::dc8b:7e8c:3540:d0b6.56037 > ff02::1:3.llmnr: UDP, length 33
00:15:44.979510 IP pc-13.home.56037 > 224.0.0.252.llmnr: UDP, length 33
00:15:44.979836 IP6 fe80::dc8b:7e8c:3540:d0b6.53843 > ff02::1:3.llmnr: UDP, length 33
00:15:44.979836 IP pc-13.home.53843 > 224.0.0.252.llmnr: UDP, length 33
00:15:44.979836 IP6 fe80::dc8b:7e8c:3540:d0b6.49531 > ff02::1:3.llmnr: UDP, length 33
00:15:44.979836 IP pc-13.home.49531 > 224.0.0.252.llmnr: UDP, length 33
00:15:45.282093 IP6 fe80::dc8b:7e8c:3540:d0b6.49531 > ff02::1:3.llmnr: UDP, length 33
00:15:45.282093 IP6 fe80::dc8b:7e8c:3540:d0b6.53843 > ff02::1:3.llmnr: UDP, length 33
00:15:45.282093 IP pc-13.home.49531 > 224.0.0.252.llmnr: UDP, length 33
00:15:45.282093 IP pc-13.home.53843 > 224.0.0.252.llmnr: UDP, length 33
00:15:45.899485 IP pc-13.home.53166 > 224.0.0.252.llmnr: UDP, length 33
00:15:45.899485 IP6 fe80::dc8b:7e8c:3540:d0b6.55775 > ff02::1:3.llmnr: UDP, length 33
00:15:45.899486 IP pc-13.home.55775 > 224.0.0.252.llmnr: UDP, length 33
00:15:46.510375 IP6 fe80::dc8b:7e8c:3540:d0b6.53166 > ff02::1:3.llmnr: UDP, length 33
00:15:46.510376 IP6 fe80::dc8b:7e8c:3540:d0b6.55775 > ff02::1:3.llmnr: UDP, length 33
00:15:46.510376 IP pc-13.home.55775 > 224.0.0.252.llmnr: UDP, length 33
00:15:46.510376 IP pc-13.home.53166 > 224.0.0.252.llmnr: UDP, length 33
00:15:47.127982 IP livebox.home > all-systems.mcast.net: igmp query v2
00:15:48.046274 IP 192.168.1.123 > 224.0.0.252: igmp v2 report 224.0.0.252
00:15:49.275014 IP pc-29.home.60767 > 255.255.255.255.teradataordbms: UDP, length 20
00:16:13.851310 ARP, Reply pote.home is-at 0c:7a:15:cb:45:fd (oui Unknown), length 28
00:16:14.158663 ARP, Reply pote.home is-at 0c:7a:15:cb:45:fd (oui Unknown), length 28
00:16:14.467877 IP6 fe80::575d:b4b9:6f8e:9ab2.55057 > ff02::1:3.llmnr: UDP, length 33
00:16:14.467877 IP poste1-pc.home.55057 > 224.0.0.252.llmnr: UDP, length 33
00:16:14.467877 IP6 fe80::575d:b4b9:6f8e:9ab2.57341 > ff02::1:3.llmnr: UDP, length 33
00:16:14.467877 IP poste1-pc.home.57341 > 224.0.0.252.llmnr: UDP, length 33
00:16:14.773337 44:d4:53:9d:92:d0 (oui Unknown) > Broadcast, ethertype Unknown (0x887b), length 60: 
